author,created_utc,id,num_comments,score,subreddit,title,upvote_ratio,url
Cerozz,1615735521.0,m4x371,0.0,1.0,FCInterMilan,Torino 0 - [1] Inter - Romelu Lukaku penalty 62',1.0,https://streamye.com/v9apv
FCInterMilan,1615726801.0,m4ux9m,281.0,1.0,FCInterMilan,"[Match Thread] Torino vs Inter (Serie A, Matchday 27)",1.0,https://www.reddit.com/r/FCInterMilan/comments/m4ux9m/match_thread_torino_vs_inter_serie_a_matchday_27/
jalan-jalan,1615706530.0,m4qhfj,9.0,1.0,FCInterMilan,Every damn time. The finish line is still far away folks.,1.0,https://i.redd.it/dhpiv7li3ym61.jpg
juvedeservesnothing,1615646624.0,m47ltd,20.0,1.0,FCInterMilan,MASSIVE W LETSSSS GOOOOOOOOO 🎉🎉🎉,1.0,https://i.redd.it/bz5ek49e5tm61.png
FCInterMilan,1615643615.0,m46pgo,1.0,1.0,FCInterMilan,Fantasy League: Torino vs Inter,1.0,https://forms.gle/mrD63ErAQBbjxrdR6
jalan-jalan,1615610361.0,m3z7s2,8.0,1.0,FCInterMilan,It really is.,1.0,https://i.redd.it/bmz0rb2k5qm61.jpg
DifferentConcept1,1615601735.0,m3wxin,13.0,1.0,FCInterMilan,Dalbert + Lazaro + J. Mario + Nainggolan = €117.00m wtf. I don't think we can sell all of them for more than €40.00m.,1.0,https://www.reddit.com/r/FCInterMilan/comments/m3wxin/dalbert_lazaro_j_mario_nainggolan_11700m_wtf_i/
DifferentConcept1,1615600954.0,m3wpoc,12.0,1.0,FCInterMilan,Imagine if Inter gets Gosens and Wijnaldum in the summer transfer window. I think it would become an unstoppable team.,1.0,https://www.reddit.com/r/FCInterMilan/comments/m3wpoc/imagine_if_inter_gets_gosens_and_wijnaldum_in_the/
ManPigBear88,1615599836.0,m3wenl,11.0,1.0,FCInterMilan,Anyone from Toronto???,1.0,https://www.reddit.com/r/FCInterMilan/comments/m3wenl/anyone_from_toronto/
Notmadebyvade,1615595037.0,m3v204,5.0,1.0,FCInterMilan,Messi and Ronaldo interview goes SEXUAL ( Messi to Inter? ),1.0,https://youtu.be/Kz1R_iF8rd4
Fresh_Opportunity_23,1615594428.0,m3uvot,0.0,1.0,FCInterMilan,The Brilliance of Romelu Lukaku in 2020/21 - Ultimate Skills &amp; Goals Sho...,1.0,https://youtube.com/watch?v=xfKC5CqQ1tY&amp;feature=share
Interfan14,1615590078.0,m3tidd,16.0,1.0,FCInterMilan,Possible improvements for next season?,1.0,https://www.reddit.com/r/FCInterMilan/comments/m3tidd/possible_improvements_for_next_season/
Interfan14,1615589041.0,m3t674,0.0,1.0,FCInterMilan,Who agrees that had we been playing like this since the begging of the season we would be in the last 16 of the UCL now honest opinions,1.0,https://www.reddit.com/r/FCInterMilan/comments/m3t674/who_agrees_that_had_we_been_playing_like_this/
happylifer,1615584646.0,m3roaw,4.0,1.0,FCInterMilan,Was this the moment Bastoni decided to switch?,1.0,https://www.reddit.com/r/FCInterMilan/comments/m3roaw/was_this_the_moment_bastoni_decided_to_switch/
Randomistar,1615580773.0,m3qbh2,3.0,1.0,FCInterMilan,"One of the best pictures I’ve seen, does anyone have the full image? Sucks that it’s split into 2.",1.0,https://www.instagram.com/p/CMUqGYllZRU/?igshid=1im9tpszpsl2l
Cerozz,1615569524.0,m3ma14,26.0,1.0,FCInterMilan,[Sky Sport Italia] Christian Eriksen has an inflammation on his left knee. He trained separately from the group today and is in doubt for Sunday’s meeting with Torino.,1.0,https://www.football-italia.net/167607/inter-eriksen-doubt-torino-clash
Forward_Ad8287,1615559731.0,m3ispl,41.0,1.0,FCInterMilan,Anyone want AC Milan to Beat Man U?,1.0,https://www.reddit.com/r/FCInterMilan/comments/m3ispl/anyone_want_ac_milan_to_beat_man_u/
FCInterMilan,1615552526.0,m3gnhz,7.0,1.0,FCInterMilan,Successful Surgery for Arturo Vidal,1.0,https://www.inter.it/en/news/2021/03/12/arturo-vidal-successful-surgery.html
FCInterMilan,1615552503.0,m3gnau,3.0,1.0,FCInterMilan,Bastoni: ‘Champions League exit a turning point for Inter’,1.0,https://www.football-italia.net/167600/bastoni-%E2%80%98champions-league-exit-turning-point-inter%E2%80%99
FCInterMilan,1615528396.0,m3b5lu,33.0,1.0,FCInterMilan,[Pre-Match Discussion] Torino vs Inter (Serie A Matchday 27),1.0,https://www.reddit.com/r/FCInterMilan/comments/m3b5lu/prematch_discussion_torino_vs_inter_serie_a/
Nerazzuri-86,1615501099.0,m32bhj,4.0,1.0,FCInterMilan,The COVID precautions/situation at Inter,1.0,https://www.reddit.com/r/FCInterMilan/comments/m32bhj/the_covid_precautionssituation_at_inter/
juvedeservesnothing,1615487696.0,m2xac3,70.0,1.0,FCInterMilan,Cristiano Ronaldo fan here...,1.0,https://www.reddit.com/r/FCInterMilan/comments/m2xac3/cristiano_ronaldo_fan_here/
5kyLegend,1615486523.0,m2wtgd,10.0,1.0,FCInterMilan,[Corriere della Sera] Beppe Marotta and Adriano Galliani hospitalized for Coronavirus,1.0,https://twitter.com/Corriere/status/1370069951852261382
Rezorblade,1615469224.0,m2q15b,2.0,1.0,FCInterMilan,Bastoni's excellent pick for Inter eleven,1.0,https://youtu.be/vCTplo5uJDQ
jalan-jalan,1615468188.0,m2ppyh,27.0,1.0,FCInterMilan,Hope Vecino step up and less Gagliardini on the last leg of championship race.,1.0,https://i.redd.it/etzo833teem61.jpg
FCInterMilan,1615467765.0,m2pl8w,7.0,1.0,FCInterMilan,Skriniar: 'This is Conte's Inter',1.0,https://www.football-italia.net/167542/skriniar-contes-inter
FCInterMilan,1615467725.0,m2pkt2,4.0,1.0,FCInterMilan,MY INTER TOP 11 with ALESSANDRO BASTONI,1.0,https://www.youtube.com/watch?v=vCTplo5uJDQ
mangowhymango,1615467125.0,m2pec5,19.0,1.0,FCInterMilan,[GdS] Vidal to undergo knee surgery. He will be out for approximately 30 days.,1.0,https://www.gazzetta.it/Calcio/Serie-A/Inter/11-03-2021/inter-vidal-si-opera-ginocchio-tornera-la-sosta-4001379977305.shtml
kuze00,1615465115.0,m2oupf,7.0,1.0,FCInterMilan,Inter Milan offered £20m new shirt sponsorship deal by porn company Stripchat,1.0,https://www.thesun.co.uk/sport/football/14288273/inter-milan-shirt-sponsorship-porn-stripchat-pirelli-contract/
SandesPT,1615459427.0,m2ngkc,17.0,1.0,FCInterMilan,Inter has rejected a 7M Euro fee by Sporting CP to keep Joao Mario [portuguese website],1.0,https://www.abola.pt/nnh/2021-03-11/sad-ja-discute-valores-com-o-inter-para-ficar-com-joao-mario/882262
hitsurio,1615436565.0,m2ho2r,0.0,1.0,FCInterMilan,Saudi's failed Newcastle takeover bidder switches attention to Inter Milan,1.0,https://www.insideworldsoccer.com/2021/03/saudi-ffailed-newcastle-takeover-bidder-switches-attention-inter%20Milan.html
FCInterMilan,1615421020.0,m2cwj1,12.0,1.0,FCInterMilan,"Gagliardini: ""There's great enthusiasm, we need to continue to display the same hunger""",1.0,https://www.inter.it/en/news/2021/03/10/interview-gagliardini-sky.html
-Nerazzurri-,1615416127.0,m2b2yd,6.0,1.0,FCInterMilan,Looking for a match ticket - Sporting V Inter 14/08/2002,1.0,https://www.reddit.com/r/FCInterMilan/comments/m2b2yd/looking_for_a_match_ticket_sporting_v_inter/
FCInterMilan,1615405300.0,m26gz4,2.0,1.0,FCInterMilan,"PLAYER INSIGHT | Football and nutrition, Lukaku has his say",1.0,https://www.youtube.com/watch?v=DBEJlgXBNzY
FCInterMilan,1615405262.0,m26gfi,2.0,1.0,FCInterMilan,"Samuel Eto'o, 40 years of the Lion King!",1.0,https://www.inter.it/en/news/2021/03/10/samuel-etoo-inter-birthday.html
FCInterMilan,1615404795.0,m269qq,25.0,1.0,FCInterMilan,Porn company offer Inter sponsorship deal?,1.0,https://www.football-italia.net/167507/porn-company-offer-inter-sponsorship-deal
nsfw_celbs,1615393409.0,m21bd4,0.0,1.0,FCInterMilan,I got ya homie!,1.0,https://direct-link.net/221756/activation
Lothar18,1615380685.0,m1ws85,1.0,1.0,FCInterMilan,One of the best ever!!!,1.0,https://twitter.com/Inter_en/status/1369630365250326529
vik1980,1615376760.0,m1vqj7,28.0,1.0,FCInterMilan,Squad Status for next season (and potential summer tweaks),0.99,https://www.reddit.com/r/FCInterMilan/comments/m1vqj7/squad_status_for_next_season_and_potential_summer/
dondostuff,1615369659.0,m1u06r,9.0,1.0,FCInterMilan,"We’ve been hearing for months now for a English variant of Covid-19, but last night we discovered the deadliest one, the Portugese variant.",1.0,https://i.redd.it/zhf3274u96m61.jpg
Nerazzuri-86,1615363799.0,m1so9i,8.0,1.0,FCInterMilan,Arpad Weisz,1.0,https://www.reddit.com/r/FCInterMilan/comments/m1so9i/arpad_weisz/
International_System,1615361532.0,m1s5mw,2.0,1.0,FCInterMilan,What would feel better Juve getting knocked out of the CL by Porto(already happened lol) or Milan fell out of top 4?,1.0,https://www.reddit.com/r/FCInterMilan/comments/m1s5mw/what_would_feel_better_juve_getting_knocked_out/
mach88888,1615361033.0,m1s1fz,3.0,1.0,FCInterMilan,De Vrij reminding Conte about his yellow card.,1.0,https://twitter.com/RSharmzz/status/1369323144293609483
Box-To-Box-Football,1615346356.0,m1o21j,0.0,1.0,FCInterMilan,"Juventus v Porto (3-2) | Should Pirlo Be Sacked?, What Next For Ronaldo? | Champions League Reaction",1.0,https://youtu.be/DekWOvOS8FU
FCInterMilan,1615342306.0,m1mrdo,5.0,1.0,FCInterMilan,"Player Ratings Results: Inter 1-0 Atalanta (Serie A, Matchday 26)",1.0,https://www.reddit.com/gallery/m1mrdo
InterPool_sbn,1615342109.0,m1moxh,0.0,1.0,FCInterMilan,Not included in the picture — the rest of Bilan’s players at the diving board,1.0,https://i.redd.it/r9j4g7ucf1m61.jpg
UnsuppressedAnger,1615338183.0,m1left,28.0,1.0,FCInterMilan,9 Reasons Skriniar Should be the Next Captain.,1.0,https://www.reddit.com/r/FCInterMilan/comments/m1left/9_reasons_skriniar_should_be_the_next_captain/
Aram_theHead,1615337417.0,m1l520,9.0,1.0,FCInterMilan,Brozo laughing at this joke (translation in comments),1.0,https://i.redd.it/9c634ylyl3m61.jpg
Sashh13,1615336715.0,m1kwq9,2.0,1.0,FCInterMilan,🙃,1.0,https://i.redd.it/9eiabqgvj3m61.jpg
adrenalinda75,1615333493.0,m1jshs,0.0,1.0,FCInterMilan,"I mean, the signs were there all along...",1.0,https://i.redd.it/kjpm28c1a3m61.png
jonbristow,1615332554.0,m1jgup,1.0,1.0,FCInterMilan,What Juve needed tonight to win,1.0,https://i.redd.it/wkiljh3i73m61.jpg
Nerazzuri-86,1615332482.0,m1jfz8,0.0,1.0,FCInterMilan,Forza Sergio,1.0,https://i.redd.it/80jqtlca73m61.jpg
Tonaz92,1615332002.0,m1j9sm,1.0,1.0,FCInterMilan,"A blessed video of Skriniar while is singing ""Co-co-Come mai la champions league non la vinci mai""",1.0,https://www.youtube.com/watch?v=NChdr4dnOtI&amp;feature=youtu.be
Lakerz4life,1615331715.0,m1j66e,4.0,1.0,FCInterMilan,Come mai?,1.0,https://youtu.be/FN7V5ez-fhc
dondostuff,1615330271.0,m1inao,0.0,1.0,FCInterMilan,😏,1.0,https://i.redd.it/m1rfkyop03m61.jpg
borkibarnica,1615330197.0,m1imac,0.0,1.0,FCInterMilan,I'll just leave this here,1.0,https://www.youtube.com/watch?v=NM3405NHG9Y
Delicious_Hand_72,1615329979.0,m1ijhb,0.0,1.0,FCInterMilan,Jube out of UCL upvote party!!!!!!!,1.0,https://www.reddit.com/r/FCInterMilan/comments/m1ijhb/jube_out_of_ucl_upvote_party/
Lori80,1615329717.0,m1ig6m,90.0,1.0,FCInterMilan,MERDA ARE ELIMINATED UPVOTE PARTY,1.0,https://www.reddit.com/r/FCInterMilan/comments/m1ig6m/merda_are_eliminated_upvote_party/
FCInterMilan,1615327260.0,m1hjwf,3.0,1.0,FCInterMilan,"HALL OF FAME | Julio Cesar, Bergomi, Cambiasso and Milito honoured with awards",1.0,https://www.inter.it/en/news/2021/03/09/hall-of-fame-awards-julio-cesar-bergomi-cambiasso-millito.html
CetnikUstasaBalija,1615314077.0,m1co4m,0.0,1.0,FCInterMilan,who tf thinks that these rumors are even remotely possible? why do people still write these crappy posts?,1.0,https://i.redd.it/5lot6l8ko1m61.jpg
5kyLegend,1615313580.0,m1chb4,10.0,1.0,FCInterMilan,Antonio Conte will be disqualified for the next match because of his 5th yellow card this Season: Cristian Stellini will be on the bench against Torino,1.0,https://twitter.com/marifcinter/status/1369329127195557892
Nerazzuri-86,1615312761.0,m1c63c,0.0,1.0,FCInterMilan,😍,1.0,https://i.redd.it/utsicqdnk1m61.jpg
ElviS_Pa,1615306180.0,m19ooc,1.0,1.0,FCInterMilan,Chi non salta rossonero è [inter players celebrating ],1.0,https://www.instagram.com/p/CMMlSfcqRiR/
Wrong_Cut_8633,1615305539.0,m19fqi,0.0,1.0,FCInterMilan,Serie A ranking,1.0,http://sport.anzzare.com/2020/12/09/serie-a-ranking/
FCInterMilan,1615302805.0,m18g1n,0.0,1.0,FCInterMilan,INTER 1-0 ATALANTA | OPEN ACCESS | We celebrate our 113th birthday in style! 🥳🖤💙,1.0,https://www.youtube.com/watch?v=D3JpA7WBQQ0
International_System,1615298441.0,m16ytu,16.0,1.0,FCInterMilan,How real are Inter’s financial problems?,1.0,https://www.reddit.com/r/FCInterMilan/comments/m16ytu/how_real_are_inters_financial_problems/
Spyro619,1615298177.0,m16vop,0.0,1.0,FCInterMilan,"New Inter Milano 2021 Logo Leaked , how serious is that information ?",1.0,https://www.google.com/amp/s/cdn.footyheadlines.com/amp/8560487270152926557
dondostuff,1615296667.0,m16f7k,26.0,1.0,FCInterMilan,😭No you can’t just sit in the back and defend😭 That’s anti-football😭 You’re top of the table😭 You should play fast😭 and attractive football😭,1.0,https://i.redd.it/8125sjjs80m61.jpg
Gagliardinter,1615294846.0,m15w5d,11.0,1.0,FCInterMilan,Anyone feel like a laugh? Bahahaha,1.0,https://twitter.com/siphillipssport/status/1369266700840009740
FCInterMilan,1615292823.0,m15dc2,0.0,1.0,FCInterMilan,INTER STATS | 7 straight wins and a third goal for Skriniar,1.0,https://www.inter.it/en/news/2021/03/09/inter-atalanta-stats-serie-a.html
FCInterMilan,1615290911.0,m14w2k,3.0,1.0,FCInterMilan,"Best birthday wishes, Youri!",1.0,https://www.inter.it/en/news/2021/03/09/djorkaeff-birthday.html
FCInterMilan,1615290892.0,m14vx9,0.0,1.0,FCInterMilan,"Many happy returns, Juan Sebastian Veron!",1.0,https://www.inter.it/en/news/2021/03/09/veron-birthday.html
jaKz9,1615287352.0,m142ny,13.0,1.0,FCInterMilan,"If anyone's curious, this is the Conte-Mariani exchange that happened around the 10th minute and led to our coach's yellow card.",1.0,https://www.reddit.com/r/FCInterMilan/comments/m142ny/if_anyones_curious_this_is_the_contemariani/
DanaWhiteOrDanaWhite,1615286299.0,m13uzv,0.0,1.0,FCInterMilan,Football Respect &amp; Most Beautiful Moments 2021 ( OR NOT ),1.0,https://youtu.be/aBF0RDn3SGg
Danleydon,1615262348.0,m0y7wg,6.0,1.0,FCInterMilan,Lukaku wallpaper OC,1.0,https://i.redd.it/8pjuotqqexl61.jpg
Interfan14,1615253356.0,m0vhwy,19.0,1.0,FCInterMilan,anybody else follow IFTV on instagram,1.0,https://www.reddit.com/r/FCInterMilan/comments/m0vhwy/anybody_else_follow_iftv_on_instagram/
FCInterMilan,1615247836.0,m0tqzi,1.0,1.0,FCInterMilan,"Goal, hugs and... The photos of the Nerazzurri's joy",1.0,https://www.inter.it/en/news/2021/03/08/photo-dressing-room-inter-atalanta-players.html
FCInterMilan,1615247763.0,m0tq6w,1.0,1.0,FCInterMilan,"Conte: ""Normal that there was pressure, important win against a good team""",1.0,https://www.youtube.com/watch?v=nFy8YU_gVLU
FCInterMilan,1615245021.0,m0st9c,4.0,1.0,FCInterMilan,INTER 113 | HAPPY BIRTHDAY TO US! 🎂⚫🔵🥳 [SUB ENG+ITA] #Inter113​,1.0,https://www.youtube.com/watch?v=HNwJ9VQZb9A
FCInterMilan,1615244322.0,m0ski3,2.0,1.0,FCInterMilan,"Handanovic: ""You always need to win by suffering, three important points""",1.0,https://www.inter.it/en/news/2021/03/08/handanovic-inter-atalanta-intervista.html
FCInterMilan,1615244008.0,m0sgov,3.0,1.0,FCInterMilan,Fantasy League Leaderboard: Inter vs Atalanta,1.0,https://airtable.com/shrePbfjp09fvN1hE
ElviS_Pa,1615242294.0,m0rv8l,20.0,1.0,FCInterMilan,Inter Vs Milan Matches,1.0,https://www.reddit.com/r/FCInterMilan/comments/m0rv8l/inter_vs_milan_matches/
mangowhymango,1615241469.0,m0rkvx,15.0,1.0,FCInterMilan,We have officially avoided relegation!,1.0,https://www.reddit.com/r/FCInterMilan/comments/m0rkvx/we_have_officially_avoided_relegation/
Tonaz92,1615240556.0,m0r882,2.0,2.0,FCInterMilan,"So Skriniar scored a goal tonight, I give to you this wallpaper made by me few years ago",1.0,https://i.redd.it/44vsppzxlvl61.jpg
Aram_theHead,1615239974.0,m0r0px,11.0,1.0,FCInterMilan,Sometimes you also need luck,1.0,https://www.reddit.com/r/FCInterMilan/comments/m0r0px/sometimes_you_also_need_luck/
TheSebi54,1615239854.0,m0qz5f,2.0,1.0,FCInterMilan,Kisses from Milan to Milan,1.0,https://i.redd.it/ccr4j1ysjvl61.png
dondostuff,1615239763.0,m0qxys,8.0,1.0,FCInterMilan,Photo of the night💪🏻,1.0,https://i.redd.it/j1aebjyjjvl61.jpg
jaKz9,1615239668.0,m0qwou,8.0,1.0,FCInterMilan,"Player Ratings Poll: Inter 1-0 Atalanta (Serie A, Matchday 26)",1.0,https://forms.gle/AKomhJYTfXKthRkTA
FCInterMilan,1615239629.0,m0qw6q,129.0,1.0,FCInterMilan,"[Post-Match Discussion] Inter 1:0 Atalanta (Serie A, Matchday 26)",1.0,https://www.reddit.com/r/FCInterMilan/comments/m0qw6q/postmatch_discussion_inter_10_atalanta_serie_a/
Cerozz,1615237216.0,m0pyhg,0.0,1.0,FCInterMilan,Inter [1] - 0 Atalanta - Milan Skriniar 54',1.0,https://streamye.com/v9rz7
Metamorphism,1615230903.0,m0nglb,1.0,1.0,FCInterMilan,20/21 3rd Kit,1.0,https://youtu.be/E3dViKApFnY
FCInterMilan,1615229100.0,m0mqg0,413.0,1.0,FCInterMilan,"[Match Thread] Inter vs Atalanta (Serie A, Matchday 26)",1.0,https://www.reddit.com/r/FCInterMilan/comments/m0mqg0/match_thread_inter_vs_atalanta_serie_a_matchday_26/
redenzogram,1615219916.0,m0j2ho,54.0,1.0,FCInterMilan,Anybody else is feeling anxious because Vidal will play in the starting 11 tonight? :P,1.0,https://www.reddit.com/r/FCInterMilan/comments/m0j2ho/anybody_else_is_feeling_anxious_because_vidal/
FCInterMilan,1615165481.0,m04800,1.0,1.0,FCInterMilan,Fantasy League: Inter vs Atalanta,1.0,https://forms.gle/xmVqD154mU84kadi7
FCInterMilan,1615130684.0,lzsqru,0.0,1.0,FCInterMilan,"Conte: “We are focussed on the present, the match against Atalanta will be another very difficult challenge.”",1.0,https://www.youtube.com/watch?v=w99KHeg-o2o
[deleted],1614940960.0,ly98o2,0.0,1.0,FCInterMilan,Djusis,1.0,https://www.reddit.com/r/FCInterMilan/comments/ly98o2/djusis/
elic173,1614906035.0,ly07qn,8.0,77.0,FCInterMilan,"Inter in our last 6 games: 6 wins, 17 scored, 2 conceded!",0.99,https://www.reddit.com/r/FCInterMilan/comments/ly07qn/inter_in_our_last_6_games_6_wins_17_scored_2/
elic173,1614903206.0,lxzbpc,4.0,2.0,FCInterMilan,"In our last 6 games: 6 wins, 17 goals scored, 6 goals conceded!",0.75,https://www.reddit.com/r/FCInterMilan/comments/lxzbpc/in_our_last_6_games_6_wins_17_goals_scored_6/
FCInterMilan,1614901346.0,lxypuj,3.0,56.0,FCInterMilan,"Skriniar: ""Parma a tough team, three important points""",1.0,https://www.inter.it/en/news/2021/03/04/interview-skriniar-parma-inter.html
FCInterMilan,1614901329.0,lxypnr,1.0,46.0,FCInterMilan,"Sanchez, decisive brace: ""You need to fight to win""",0.97,https://www.inter.it/en/news/2021/03/04/sanchez-goal-brace-post-match-interview.html
FCInterMilan,1614901273.0,lxyp02,2.0,33.0,FCInterMilan,"Conte: ""Every match is a battle. The lads are now interpreting games better""",1.0,https://www.youtube.com/watch?v=_RcejBacJmQ
FCInterMilan,1614899698.0,lxy632,0.0,12.0,FCInterMilan,Fantasy League Leaderboard: Parma vs Inter,0.89,https://airtable.com/shrePbfjp09fvN1hE
CapitalSV,1614899346.0,lxy1rk,5.0,32.0,FCInterMilan,I’ve always loved the home top with white shorts kit. Top of the league lads. Cheers 🍻,0.95,https://www.reddit.com/r/FCInterMilan/comments/lxy1rk/ive_always_loved_the_home_top_with_white_shorts/
Simoseks,1614894744.0,lxwfan,2.0,2.0,FCInterMilan,Conte congratulating Hakimi for his late game effort.... in a Conte-esque way,1.0,https://streamable.com/gnmm00
Cerozz,1614894426.0,lxwb5a,15.0,144.0,FCInterMilan,Conte slapping the love out of Hakimi for his late game pressing.,1.0,https://twitter.com/Smiley_1932/status/1367591385004601348
jaKz9,1614894230.0,lxw8qd,2.0,16.0,FCInterMilan,"Player Ratings Poll: Parma 1-2 Inter (Serie A, Matchday 25)",1.0,https://forms.gle/RmsdLt7mF4yhQkV59
FCInterMilan,1614894098.0,lxw71u,168.0,51.0,FCInterMilan,"[Post-Match Discussion] Parma 1:2 Inter (Serie A, Matchday 25)",0.98,https://www.reddit.com/r/FCInterMilan/comments/lxw71u/postmatch_discussion_parma_12_inter_serie_a/
Cerozz,1614892167.0,lxvhyw,2.0,36.0,FCInterMilan,Parma 0 - [2] Inter - Alexis Sánchez 62',0.98,https://streamye.com/vdvwg
Cerozz,1614891840.0,lxvdrf,3.0,22.0,FCInterMilan,Parma 0 - [1] Inter - Alexis Sánchez 54',0.94,https://streamye.com/vk7vm
FCInterMilan,1614883501.0,lxrxt3,503.0,18.0,FCInterMilan,"[Match Thread] Parma vs Inter (Serie A, Matchday 25)",0.96,https://www.reddit.com/r/FCInterMilan/comments/lxrxt3/match_thread_parma_vs_inter_serie_a_matchday_25/
NBAsid,1614881083.0,lxr01o,8.0,1.0,FCInterMilan,After 10 years we are about to win our first scudetto (check comments),0.6,https://i.redd.it/8onu1vh0x1l61.jpg
redenzogram,1614877988.0,lxpp3q,12.0,35.0,FCInterMilan,When you can go 6 points ahead of (R) Milan but you have to play against Parma,1.0,https://www.reddit.com/r/FCInterMilan/comments/lxpp3q/when_you_can_go_6_points_ahead_of_r_milan_but_you/
dondostuff,1614876472.0,lxp2yp,16.0,134.0,FCInterMilan,"Lauti on Hakimi: Morocco-Argentina, i hear someone calling me in Spanish, I turn around, it was him, never talked before. He told me he knew Borja Valero and he followed our team. Then we met again in Dortmund-Inter, we kept in touch. He told me he would have likes to play for our team, and then...",1.0,https://i.redd.it/roebr94cj1l61.jpg
matthewsrichardson,1614876058.0,lxox4l,14.0,11.0,FCInterMilan,Lothar Matthaus Prime in FM,1.0,https://www.reddit.com/r/FCInterMilan/comments/lxox4l/lothar_matthaus_prime_in_fm/
dondostuff,1614861705.0,lxjly9,46.0,42.0,FCInterMilan,Not that I care but this surely needs to look at,1.0,https://i.redd.it/pqje2xdfb0l61.jpg
slap_of_doom,1614859546.0,lxj0j5,32.0,86.0,FCInterMilan,"He may not be the player he once was, but he is still Chile’s most capped player and our top goal scorer. Que viva El Niño Maravilla po!!!",0.96,https://imgur.com/a/HvL9YH8/
ibrahimahmed75,1614813821.0,lx76zn,0.0,1.0,FCInterMilan,How does milan keep getting these pens,1.0,https://www.reddit.com/r/FCInterMilan/comments/lx76zn/how_does_milan_keep_getting_these_pens/
NO_IDEA_FAN69,1614811629.0,lx6ga2,0.0,2.0,FCInterMilan,Champions,1.0,https://www.reddit.com/r/FCInterMilan/comments/lx6ga2/champions/
FCInterMilan,1614801568.0,lx2vyh,2.0,10.0,FCInterMilan,Fantasy League: Parma vs Inter,0.87,https://forms.gle/XAEDRNL97W3AwfuR8
FCInterMilan,1614784348.0,lww4tu,4.0,45.0,FCInterMilan,"Conte: ""Against Parma attention will be needed, determination and mentality will count from here until the end""",0.95,https://www.youtube.com/watch?v=vPVp3Zj4joQ
FCInterMilan,1614783900.0,lwvyis,4.0,17.0,FCInterMilan,Inter doubt Man Utd 'compensation' claim,0.91,https://www.football-italia.net/167167/inter-doubt-man-utd-compensation-claim
hallak70,1614767667.0,lwqst1,149.0,27.0,FCInterMilan,Saudi investment fund looking to buy inter,0.89,https://twitter.com/marifcinter/status/1366897796910092302?s=09
hallak70,1614766662.0,lwqk9a,2.0,1.0,FCInterMilan,Saudi investment buying inter,1.0,https://www.reddit.com/r/FCInterMilan/comments/lwqk9a/saudi_investment_buying_inter/
[deleted],1614760913.0,lwp64r,0.0,1.0,FCInterMilan,The biggest regret of Inter Milan Legend Javier Zanetti's career,1.0,https://www.chaseyoursport.com/Football/The-biggest-regret-of-Inter-Milan-Legend-Javier-Zanetti-career/2343
Nerazzuri-86,1614730977.0,lwgm9y,21.0,1.0,FCInterMilan,End Of An Era: The Best Inter x Pirelli Shirts,1.0,https://www.soccerbible.com/performance/football-apparel/2021/03/end-of-an-era-the-best-inter-x-pirelli-shirts/
Phil_996,1614722458.0,lwdpca,15.0,1.0,FCInterMilan,Looks like we are after wijnaldum... surely fake news but boy I would love this,1.0,http://sportwitness.co.uk/liverpool-player-given-handshake-move-away-reds-summer-window/
deathsmack,1614718015.0,lwc3pe,1.0,1.0,FCInterMilan,"Is Ranocchia's name really displayed as ""Frog"" on his match kit? Haha",1.0,https://i.redd.it/yhzmz72xfok61.png
Nerazzuri-86,1614708332.0,lw8fdm,13.0,1.0,FCInterMilan,Everyone is maybe buying Inter,1.0,https://www.fedenerazzurra.net/news/2021/3/2/talks-with-bc-partners-continue-but-now-theres-a-qatar-fund-seriously-interested-in-buying-inter
ManuelAlvarezz,1614707353.0,lw81ad,1.0,1.0,FCInterMilan,Official: Pirelli no longer Inter shirt sponsor from next season after 27 years [Football-Italia],1.0,https://www.football-italia.net/167081/official-pirelli-no-longer-inter-shirt-sponsor-next-season
ManuelAlvarezz,1614706191.0,lw7kod,12.0,1.0,FCInterMilan,Most expensive players in history aged 18 or younger,1.0,https://i.redd.it/ore4yz5frlk61.jpg
Cerozz,1614706019.0,lw7iaz,1.0,1.0,FCInterMilan,In depth data analysis of Alessandro Bastoni,1.0,https://nutmegassist.com/alessandro-bastoni-data-analysis-20-21/
[deleted],1614705992.0,lw7hxw,0.0,1.0,FCInterMilan,In depth analysis of Alessandro Bastoni,1.0,https://nutmegassist.com/alessandro-bastoni-data-analysis-20-21/
5kyLegend,1619701496.0,n13wcm,22.0,1.0,FCInterMilan,New mural dedicated to Lukaku at San Siro,1.0,https://i.redd.it/4sptzssi24w61.png
OsamaRH1,1619701393.0,n13v4e,27.0,1.0,FCInterMilan,Do you think Conte can lead us to European success ?,1.0,https://www.reddit.com/r/FCInterMilan/comments/n13v4e/do_you_think_conte_can_lead_us_to_european_success/
Paconxy,1619686762.0,n10bzx,59.0,1.0,FCInterMilan,Has Eriksen been a key player for Inter this season?,1.0,https://www.reddit.com/r/FCInterMilan/comments/n10bzx/has_eriksen_been_a_key_player_for_inter_this/
ravensadrix,1619676518.0,n0y5ix,24.0,1.0,FCInterMilan,be honest guys,1.0,https://i.redd.it/adltsn8b02w61.jpg
FCInterMilan,1619640568.0,n0nlgt,0.0,1.0,FCInterMilan,"Barella: ""Beating Juventus made us aware of our strength""",1.0,https://www.inter.it/en/news/2021/04/28/interview-nicolo-barella-sky.html
Pollack1985,1619640201.0,n0ngok,0.0,1.0,FCInterMilan,ALMOST READY,1.0,https://www.reddit.com/r/FCInterMilan/comments/n0ngok/almost_ready/
gui2190,1619628271.0,n0j2yq,5.0,1.0,FCInterMilan,"Had this idea as a shirt for a while, but figured a wallpaper is less likely to violate trademarks lol",1.0,https://i.redd.it/gqtnwj53zxv61.png
FCInterMilan,1619620965.0,n0gceu,5.0,1.0,FCInterMilan,Inter have lost fewer league games than any other side from Europe's top five leagues,1.0,https://twitter.com/livescore/status/1386719219778301953
5kyLegend,1619615035.0,n0ebz2,38.0,1.0,FCInterMilan,Max Pezzali - I M Inter (2021) [Inter's new Anthem starting next Season],1.0,https://www.youtube.com/watch?v=tzsaxJH_2SM
