author,created_utc,id,num_comments,score,subreddit,title,upvote_ratio,url
Cloutweb1,1609173645.0,kltt1v,6.0,1.0,FCInterMilan,Questo ci ha fatto soffrire dai tempi alla Roma,1.0,https://www.gazzetta.it/Calcio/Calciomercato/Inter/28-12-2020/calciomercato-inter-conte-vuole-gervinho-come-vice-lukaku-3902034775068.shtml
FCInterMilan,1609166689.0,klrrgz,0.0,1.0,FCInterMilan,Inter review | The 10 best assists from 2020,1.0,https://www.youtube.com/watch?v=EJ5MRMAB2c4
reddithenry,1609147876.0,klndgc,38.0,1.0,FCInterMilan,What do we think about Donnarumma?,1.0,https://www.reddit.com/r/FCInterMilan/comments/klndgc/what_do_we_think_about_donnarumma/
AutoModerator,1609110279.0,kldnd2,24.0,1.0,FCInterMilan,Weekly free talk thread. AMALA! [Week #52],1.0,https://www.reddit.com/r/FCInterMilan/comments/kldnd2/weekly_free_talk_thread_amala_week_52/
thegoonie10,1609104932.0,klc18w,7.0,1.0,FCInterMilan,so I want to learn more about inter. What YouTube videos can look at and maybe something online I can read about club. Also am gonna start by doing a career mode on fifa 21 😅 I would like to know who are linked to and where should send scouts and who should sell?Thank you:),1.0,https://www.reddit.com/r/FCInterMilan/comments/klc18w/so_i_want_to_learn_more_about_inter_what_youtube/
dondostuff,1609086467.0,kl6f1c,6.0,1.0,FCInterMilan,Juventus when they pay the referees to officiate in favor of the opponent so they can have an argument to say the next time they buy them.,1.0,https://i.redd.it/wzxo7pgoar761.jpg
FCInterMilan,1609079791.0,kl4n7s,2.0,1.0,FCInterMilan,The Top-10 Nerazzurri goals from 2020,1.0,https://www.youtube.com/watch?v=8MTpZNM2640
r_kharman,1609075139.0,kl3jse,0.0,1.0,FCInterMilan,PAPU GOMEZ ON THE MOVE?,1.0,https://youtu.be/XyIebZ5jgR4
biscione111,1609048787.0,kkyg7k,6.0,1.0,FCInterMilan,Does anyone know if there’s somewhere online where I can watch full matches from previous seasons?,1.0,https://www.reddit.com/r/FCInterMilan/comments/kkyg7k/does_anyone_know_if_theres_somewhere_online_where/
International_System,1609040032.0,kkwc3e,14.0,1.0,FCInterMilan,Does anyone else kind of miss Icardi? Of course I would rather have what we have but he genuinely loved the club but he just loved the absolute nonce called Wanda more,1.0,https://www.reddit.com/r/FCInterMilan/comments/kkwc3e/does_anyone_else_kind_of_miss_icardi_of_course_i/
ashkanbns,1609014072.0,kkp61c,3.0,1.0,FCInterMilan,Introducing a fantastic Inter-oriented youtube channel (podcast - discussion - reactions),1.0,https://www.youtube.com/user/SempreIntercom
RealBigChief,1609003294.0,kkm348,45.0,1.0,FCInterMilan,January transfer window,1.0,https://www.reddit.com/r/FCInterMilan/comments/kkm348/january_transfer_window/
intermaniax1,1608933445.0,kk6s3a,0.0,1.0,FCInterMilan,Merry Christmas 💙🖤💙🖤💙🖤,1.0,https://i.imgur.com/B9oD8zJ.jpg
thecalciodays,1608924451.0,kk4ihe,14.0,1.0,FCInterMilan,Buon Natale! Here’s Inter’s January match calendar. Hope you all had a great Christmas!,1.0,https://i.redd.it/6h1kyr9xwd761.jpg
morpholus,1608902426.0,kjyx3y,7.0,1.0,FCInterMilan,Visited my dad for Christmas and found this beauty in my child's room. Signed by GK legend Francesco Toldo. Memories...,1.0,https://i.redd.it/eu6bc4hf3c761.jpg
FCInterMilan,1608836873.0,kjkv93,4.0,1.0,FCInterMilan,CHRISTMAS GREETINGS FROM INTER! #InterXmas 🎅🏻⚫🔵🥳,1.0,https://www.youtube.com/watch?v=zevhVTX33Bc
FCInterMilan,1608832894.0,kjjqfv,7.0,1.0,FCInterMilan,"Player Ratings Results: Verona 1-2 Inter (Serie A, Matchday 14)",1.0,https://i.redd.it/9jxbvu7ec6761.png
Immense_Dad_,1608821180.0,kjgk8o,2.0,1.0,FCInterMilan,Inter has repeated its record for the most goals in a year,1.0,https://www.reddit.com/r/FCInterMilan/comments/kjgk8o/inter_has_repeated_its_record_for_the_most_goals/
Jrdm92,1608802706.0,kjcmf4,0.0,1.0,FCInterMilan,Romelu Lukaku - All 35 Goals for Inter Milan (2020),1.0,https://youtu.be/TyNDQAUcNNM
elic173,1608779892.0,kj7mtj,0.0,1.0,FCInterMilan,"Found a super cheap kit from our treble season, too bad it’s not my size but wanted to let you guys know... I’ve been wanting it for really long but the ones in my size are super expensive :(",1.0,https://www.classicfootballshirts.co.uk/2009-10-inter-milan-home-basic-shirt-very-good-xl.html
elic173,1608759835.0,kj20hn,0.0,2.0,FCInterMilan,Fuck Milan,1.0,https://www.reddit.com/r/FCInterMilan/comments/kj20hn/fuck_milan/
FCInterMilan,1608759245.0,kj1u0v,0.0,1.0,FCInterMilan,HELLAS VERONA 1-2 INTER | SKRINIAR + LAUTARO EXCLUSIVE INTERVIEWS [SUB ENG],1.0,https://www.youtube.com/watch?v=FakIcWD2CpY
FCInterMilan,1608759202.0,kj1tlj,1.0,1.0,FCInterMilan,"Conte: ""A team win following a tough and determined performance""",1.0,https://www.youtube.com/watch?v=5p4SI3T5_h4
FCInterMilan,1608759112.0,kj1slv,0.0,1.0,FCInterMilan,"Skriniar, a goal and a kiss: ""We knew that it would be tough""",1.0,https://www.inter.it/en/news/2020/12/23/skriniar-interview-verona-inter.html
FCInterMilan,1608759084.0,kj1saz,0.0,1.0,FCInterMilan,"Lautaro: ""It was a tough game, I'm happy with the goal and the win""",1.0,https://www.inter.it/en/news/2020/12/23/lautaro-martinez-interview-verona-inter.html
FCInterMilan,1608759068.0,kj1s4d,0.0,1.0,FCInterMilan,"Conte: ""A team win following a tough and determined performance""",1.0,https://www.inter.it/en/news/2020/12/23/conte-interview-verona-inter.html
FCInterMilan,1608755798.0,kj0rvi,3.0,1.0,FCInterMilan,"Fantasy League Finale: Verona vs Inter (Serie A, Matchday 14)",1.0,https://airtable.com/shrE7MM4U15yv19Dk
intermaniax1,1608753778.0,kj05f6,5.0,1.0,FCInterMilan,Am alone in not wanting to be winter champion again?,1.0,https://www.reddit.com/r/FCInterMilan/comments/kj05f6/am_alone_in_not_wanting_to_be_winter_champion/
jaKz9,1608751762.0,kizin0,8.0,1.0,FCInterMilan,"Player Ratings Poll: Verona 1-2 Inter (Serie A, Matchday 14)",1.0,https://forms.gle/2ypeS7fztgoAUxEr9
FCInterMilan,1608751672.0,kizhms,105.0,1.0,FCInterMilan,"[Post-Match Discussion] Verona 1:2 Inter (Serie A, Matchday 14)",1.0,https://www.reddit.com/r/FCInterMilan/comments/kizhms/postmatch_discussion_verona_12_inter_serie_a/
Cerozz,1608751659.0,kizhhl,9.0,1.0,FCInterMilan,De Vrij reaches 100 appearances for Inter!,1.0,https://i.redd.it/uht59mz2nz661.png
Cerozz,1608750256.0,kiz1xm,0.0,1.0,FCInterMilan,Verona 1-[2] Inter - Milan Skriniar 69',1.0,https://streamvi.com/watch/1608750197
Cerozz,1608749182.0,kiyptl,0.0,1.0,FCInterMilan,Verona 0-1 Inter - Lautaro Martinez 52',1.0,https://streamvi.com/watch/1608749121
Cerozz,1608745426.0,kixjik,62.0,1.0,FCInterMilan,"Marotta to @SkySport : ""Yes, I can confirm that Christian Eriksen is on the transfer list. He's gonna leave in January. He's not functional to our plans and he had difficulty here at Inter. I think it's right that Christian goes away to find more space.""",1.0,https://twitter.com/fabrizioromano/status/1341795819335409664?s=21
FCInterMilan,1608741000.0,kiw5tr,313.0,1.0,FCInterMilan,"[Match Thread] Verona vs Inter (Serie A, Matchday 14)",1.0,https://www.reddit.com/r/FCInterMilan/comments/kiw5tr/match_thread_verona_vs_inter_serie_a_matchday_14/
flonnkenn,1608722111.0,kir9rh,11.0,1.0,FCInterMilan,Who remembers this stupidity from an otherwise wonderful season?,1.0,https://www.reddit.com/r/FCInterMilan/comments/kir9rh/who_remembers_this_stupidity_from_an_otherwise/
philipagg,1608716132.0,kiq4ag,46.0,1.0,FCInterMilan,"Hi. I'm a Relatively new Inter fan. Been supporting the club for 3 and a half years now. Since around may 2017 for the 2016/17 season. Can someone explain to me what happened during 2010&amp;then cuz I can't find anything about that era. Also, Use 4 words for how this photo makes you feel.",1.0,https://i.redd.it/2w4i8ffhpw661.jpg
ravensadrix,1608705948.0,kio3kj,31.0,1.0,FCInterMilan,"This is my design for the next season, if Inter contracts with Adidas what do you think guys?",1.0,https://i.redd.it/xyi0cjsuuv661.png
TheSebi54,1608672667.0,kiekk4,21.0,1.0,FCInterMilan,Juve Taking 2 L's in 1 day,1.0,https://i.redd.it/9sdiu7s74t661.jpg
dondostuff,1608660611.0,kianml,22.0,1.0,FCInterMilan,Giuventus biggest enemies in their history🤣,1.0,https://i.redd.it/jk5svl2e4s661.jpg
reddithenry,1608656708.0,ki9bjr,45.0,1.0,FCInterMilan,Napoli-Juve to be replayed,1.0,https://www.reddit.com/r/FCInterMilan/comments/ki9bjr/napolijuve_to_be_replayed/
FCInterMilan,1608653535.0,ki89fg,7.0,1.0,FCInterMilan,"Fantasy League Finale: Verona vs Inter (Serie A, Matchday 14)",1.0,https://forms.gle/2pT6QrHY4Kn8r7C98
FCInterMilan,1608652822.0,ki814t,3.0,1.0,FCInterMilan,"Conte: ""We'll put in all our energy against Verona""",1.0,https://www.inter.it/en/news/2020/12/22/conte-presser-verona-inter.html
FCInterMilan,1608645133.0,ki5plg,19.0,1.0,FCInterMilan,[Pre-Match Discussion] Verona vs Inter (Serie A Matchday 14),1.0,https://www.reddit.com/r/FCInterMilan/comments/ki5plg/prematch_discussion_verona_vs_inter_serie_a/
FCInterMilan,1608644588.0,ki5k7q,3.0,1.0,FCInterMilan,"Happy birthday, Beppe Bergomi",1.0,https://www.inter.it/en/news/2020/12/22/bergomi-birthday.html
erock561,1608606558.0,khwrxk,1.0,1.0,FCInterMilan,fifa 21 xbox one tourney,1.0,https://www.reddit.com/r/FCInterMilan/comments/khwrxk/fifa_21_xbox_one_tourney/
adrenalinda75,1608586195.0,khqpn3,35.0,1.0,FCInterMilan,-10 to the winter transfer window and I just read about a potential Eriksen / Paredes swap on Eurosport. Thoughts?,1.0,https://www.reddit.com/r/FCInterMilan/comments/khqpn3/10_to_the_winter_transfer_window_and_i_just_read/
Cerozz,1608574294.0,khmo5j,8.0,1.0,FCInterMilan,Nainggolan's move to Cagliari in January doesn't seem all that likely according to latest interviews.,1.0,https://www.reddit.com/r/FCInterMilan/comments/khmo5j/nainggolans_move_to_cagliari_in_january_doesnt/
Cerozz,1608574252.0,khmnkh,0.0,1.0,FCInterMilan,Nainggolan's move to Cagliari doesn't seem all that likely in January according to latest interviews.,1.0,https://www.reddit.com/r/FCInterMilan/comments/khmnkh/nainggolans_move_to_cagliari_doesnt_seem_all_that/
FCInterMilan,1608571944.0,khlwf5,0.0,1.0,FCInterMilan,Inter Stats | Hakimi's goals and Lukaku's precision,1.0,https://www.inter.it/en/news/2020/12/21/inter-spezia-stats-lukaku-penalties-hakimi-goals.html
FCInterMilan,1608568585.0,khktmm,6.0,1.0,FCInterMilan,"Player Ratings Results: Inter 2-1 Spezia (Serie A, Matchday 13)",1.0,https://www.reddit.com/gallery/khktmm
Cerozz,1608564715.0,khjlai,5.0,1.0,FCInterMilan,Happy birthday to our el presidente Steven Zhang. He turned 29 today and celebrated his third birthday as Inter president.,1.0,https://www.inter.it/en/news/2020/12/21/steven-zhang-birthday.html
Belliuss,1608561151.0,khii30,9.0,1.0,FCInterMilan,Mismanagement of our midfield.,1.0,https://i.redd.it/x4fj7dplwj661.jpg
AutoModerator,1608505479.0,kh4iyc,71.0,1.0,FCInterMilan,Weekly free talk thread. AMALA! [Week #51],1.0,https://www.reddit.com/r/FCInterMilan/comments/kh4iyc/weekly_free_talk_thread_amala_week_51/
FCInterMilan,1608485891.0,kgya05,1.0,1.0,FCInterMilan,"Hakimi once again on the scoresheet: ""We're aiming to gain consistency""",1.0,https://www.inter.it/en/news/2020/12/20/hakimi-interview-inter-2-1-spezia.html
FCInterMilan,1608485866.0,kgy9qs,0.0,1.0,FCInterMilan,Conte: “We must grit our teeth and finish this round of matches in the best possible fashion”,1.0,https://www.inter.it/en/news/2020/12/20/conte-post-match-interview-inter-spezia.html
FCInterMilan,1608485848.0,kgy9ih,12.0,1.0,FCInterMilan,"Sensi: ""An important win, I'm feeling increasingly better""",1.0,https://www.inter.it/en/news/2020/12/20/interview-sensi-inter-2-1-spezia.html
FCInterMilan,1608481769.0,kgwyp4,1.0,1.0,FCInterMilan,"Updated Fantasy League Leaderboard: Inter vs Spezia (Serie A, Matchday 13)",1.0,https://airtable.com/shrE7MM4U15yv19Dk
jaKz9,1608480365.0,kgwjhm,0.0,1.0,FCInterMilan,"Player Ratings Poll: Inter 2-1 Spezia (Serie A, Matchday 13)",1.0,https://forms.gle/EqxqqQA1VMjhn2nRA
FCInterMilan,1608479813.0,kgwcor,41.0,1.0,FCInterMilan,"[Post-Match Discussion] Inter 2:1 Spezia (Serie A, Matchday 13)",1.0,https://www.reddit.com/r/FCInterMilan/comments/kgwcor/postmatch_discussion_inter_21_spezia_serie_a/
Cerozz,1608478537.0,kgvzcn,0.0,1.0,FCInterMilan,Inter 2-0 Spezia - Romelu Lukaku PK 71',1.0,https://streamable.com/byixgs
Cerozz,1608478532.0,kgvzaw,0.0,1.0,FCInterMilan,Inter 1-0 Spezia - Achraf Hakimi 51',1.0,https://streamable.com/qkuk52
FCInterMilan,1608469200.0,kgtlhh,190.0,1.0,FCInterMilan,"[Match Thread] Inter vs Spezia (Serie A, Matchday 13)",1.0,https://www.reddit.com/r/FCInterMilan/comments/kgtlhh/match_thread_inter_vs_spezia_serie_a_matchday_13/
FCInterMilan,1608386653.0,kg87m4,2.0,2.0,FCInterMilan,Fantasy League: Inter vs Spezia (Serie A Matchday 13),1.0,https://forms.gle/QXPWePmhtkR5yShG7
FCInterMilan,1608386405.0,kg857d,29.0,2.0,FCInterMilan,[Pre-Match Discussion] Inter vs Spezia (Serie A Matchday 13),1.0,https://www.reddit.com/r/FCInterMilan/comments/kg857d/prematch_discussion_inter_vs_spezia_serie_a/
DonJacinto,1608358114.0,kg2kgd,10.0,1.0,FCInterMilan,Why are the matches scheduled so early this season? Is it because the fans are absent?,1.0,https://www.reddit.com/r/FCInterMilan/comments/kg2kgd/why_are_the_matches_scheduled_so_early_this/
biscione92,1608349294.0,kg0hno,3.0,3.0,FCInterMilan,Talking Inter with Pete from Italian football TV,0.81,https://www.reddit.com/r/FCInterMilan/comments/kg0hno/talking_inter_with_pete_from_italian_football_tv/
FCInterMilan,1608340992.0,kfybxk,6.0,16.0,FCInterMilan,"Happy Birthday, Alexis!",1.0,https://www.inter.it/en/news/2020/12/19/birthday-sanchez.html
Danklord_Ezio,1608310534.0,kfotye,40.0,11.0,FCInterMilan,Christian Eriksen at Inter Milan: What possibly went wrong for him at Inter and what’s next?,0.92,https://footviser.com/editorial/christian-eriksen-at-inter-reasons/
interfan1999,1608302749.0,kfmdv2,49.0,50.0,FCInterMilan,An all-time international map of our players!,0.99,https://i.redd.it/a1zqfb6aky561.jpg
albnasc,1608297194.0,kfkw0z,0.0,1.0,FCInterMilan,The story Zhang Zhingdong and why he bought the club,1.0,https://youtu.be/JfmN0teDRn8
FCInterMilan,1608296231.0,kfkndx,4.0,14.0,FCInterMilan,Inter on top of the world 10 years ago | 10 things to remember,0.9,https://www.inter.it/en/news/2020/12/18/inter-mazembe-club-world-cup-2010.html
FCInterMilan,1608296225.0,kfknc6,3.0,25.0,FCInterMilan,"Happy Birthday, Gianluca!",1.0,https://www.inter.it/en/news/2020/12/18/birthday-pagliuca.html
FCInterMilan,1608296221.0,kfknav,0.0,8.0,FCInterMilan,INTER LIFE | CHRISTMAS 2020 EDITION with IVAN PERISIC and MATTEO DARMIAN ☃️🖤💙 [ITA+ENG SUBS],0.91,https://www.youtube.com/watch?v=P2EvC0FzwFc
FCInterMilan,1608243929.0,kf7t6f,22.0,18.0,FCInterMilan,"Player Ratings Results: Inter 1-0 Napoli (Serie A, Matchday 12)",0.96,https://www.reddit.com/gallery/kf7t6f
FCInterMilan,1608226969.0,kf24iq,0.0,2.0,FCInterMilan,INTER 1-0 NAPOLI | OPEN ACCESS | Christmas is coming: another win! 🎄⚫🔵,1.0,https://www.youtube.com/watch?v=a3fLnUAjIPI
FCInterMilan,1608226846.0,kf2337,1.0,2.0,FCInterMilan,Ugly but winning Inter,1.0,https://www.football-italia.net/163640/ugly-winning-inter
Bistcrom,1608222412.0,kf0kp4,8.0,1.0,FCInterMilan,Inter's third kit of 2021/2022 season leaked. Ludicrous.,1.0,https://i.redd.it/ckw8mbbexr561.jpg
changweimao,1608217367.0,kez091,0.0,1.0,FCInterMilan,有肠胃在吗,1.0,https://www.reddit.com/r/FCInterMilan/comments/kez091/有肠胃在吗/
FCInterMilan,1608213762.0,kexzgq,1.0,2.0,FCInterMilan,Inter Stats | The irrepressible Lukaku and Inter's goals in the final 30 minutes,1.0,https://www.inter.it/en/news/2020/12/17/inter-napoli-stats.html
Barshady18,1608202010.0,kev9nf,20.0,1.0,FCInterMilan,Why do they celebrate like that?,1.0,https://i.redd.it/3uincjiq8q561.jpg
ultimatebot3000,1608173414.0,keom4n,1.0,1.0,FCInterMilan,Match Recap Inter 1-0 Napoli | Lukaku Takes Inter to Within a Point of the Top | Serie A TIM,1.0,https://youtu.be/pVHmmfmgW_4
Rezorblade,1608169272.0,kenb2c,8.0,3.0,FCInterMilan,"Stole it from Milan sub, let's get top of the standing this weekend!",1.0,https://i.imgur.com/qsxdpOz.jpg
FCInterMilan,1608161985.0,kel25a,0.0,1.0,FCInterMilan,"INTER 1-0 NAPOLI | ANTONIO CONTE EXCLUSIVE INTERVIEW: ""A very tactical game"" [SUB ENG]",1.0,https://www.youtube.com/watch?v=CUO_JL6G94I
FCInterMilan,1608161959.0,kel1si,0.0,1.0,FCInterMilan,INTER 1-0 NAPOLI | SAMIR HANDANOVIC + MATTEO DARMIAN EXCLUSIVE INTERVIEWS [SUB ENG],1.0,https://www.youtube.com/watch?v=qP7mAJIzTL0
FCInterMilan,1608160449.0,kekkcq,2.0,1.0,FCInterMilan,"Handanovic: ""An important win following a tactical battle""",1.0,https://www.inter.it/en/news/2020/12/16/handanovic-interview-inter-napoli.html
FCInterMilan,1608160415.0,kekjyz,2.0,1.0,FCInterMilan,"Conte: ""It was a very tactical game, winning matches like this is a great sign""",1.0,https://www.inter.it/en/news/2020/12/16/conte-post-match-inter-napoli.html
Cerozz,1608157543.0,kejkdg,11.0,3.0,FCInterMilan,"Last game it was Lord Danilo, this game it was Saint Samiro.",1.0,https://i.redd.it/sdii7s2hkm561.jpg
FCInterMilan,1608156655.0,kej9qt,4.0,1.0,FCInterMilan,Updated Fantasy League Leaderboard (Inter vs Napoli),1.0,https://airtable.com/shrE7MM4U15yv19Dk/tblzWCki5uqlUaCtl
harpsabu,1608155437.0,keiuxt,1.0,1.0,FCInterMilan,Conte out,1.0,https://twitter.com/OptaPaolo/status/1339325990909128704?s=19
jaKz9,1608155051.0,keiq9a,18.0,1.0,FCInterMilan,"Player Ratings Poll: Inter 1-0 Napoli (Serie A, Matchday 12)",1.0,https://forms.gle/xihLrdGDEJxxGqDQ9
FCInterMilan,1608154966.0,keip82,102.0,2.0,FCInterMilan,"[Post-Match Discussion] Inter 1:0 Napoli (Serie A, Matchday 12)",1.0,https://www.reddit.com/r/FCInterMilan/comments/keip82/postmatch_discussion_inter_10_napoli_serie_a/
Cerozz,1608153728.0,keiajd,3.0,1.0,FCInterMilan,Inter 1-0 Napoli - Romelu Lukaku penalty 71',1.0,https://streamja.com/1jW76
FCInterMilan,1608144300.0,kef3f3,332.0,1.0,FCInterMilan,"[Match Thread] Inter vs Napoli (Serie A, Matchday 12)",1.0,https://www.reddit.com/r/FCInterMilan/comments/kef3f3/match_thread_inter_vs_napoli_serie_a_matchday_12/
FCInterMilan,1608135361.0,kec3v8,2.0,1.0,FCInterMilan,Inter: Sanchez and Vidal injury update,1.0,https://www.football-italia.net/163573/inter-sanchez-and-vidal-injury-update
Gabry5015,1608118701.0,ke7nzp,20.0,1.0,FCInterMilan,Would you sign Rovella?,1.0,https://www.reddit.com/r/FCInterMilan/comments/ke7nzp/would_you_sign_rovella/
FCInterMilan,1608063259.0,kdth4o,6.0,1.0,FCInterMilan,"Fantasy League: Inter vs Napoli (Serie A, Matchday 12)",1.0,https://forms.gle/czxbSGRQhHgeQQzK7
FCInterMilan,1608046280.0,kdnsjv,23.0,1.0,FCInterMilan,[Pre-Match Discussion] Inter vs Napoli (Serie A Matchday 12),1.0,https://www.reddit.com/r/FCInterMilan/comments/kdnsjv/prematch_discussion_inter_vs_napoli_serie_a/
FCInterMilan,1608037981.0,kdlhkq,2.0,1.0,FCInterMilan,INTER vs NAPOLI | LIVE | ANTONIO CONTE PRE-MATCH PRESS CONFERENCE | 🎙️⚫🔵 [SUB ENG],1.0,https://www.youtube.com/watch?v=yq6KP31G92E
dondostuff,1608034333.0,kdkmw1,52.0,1.0,FCInterMilan,"Christian Vieri: Lukaku would score as many goals as Lewandowski if he played for Bayern, but Lewandowski wouldn’t score as many goals as Lukaku if he played for Inter.",1.0,https://app.football-italia.net/?referrer=https%3A%2F%2Fwww.football-italia.net%2F163497%2Fvieri-%25E2%2580%2598lewandowski-wouldn%25E2%2580%2599t-score-much-lukaku-inter%25E2%2580%2599#article/footballitalia-163497
philipagg,1608023553.0,kdigl1,27.0,1.0,FCInterMilan,Who was more right? icardi or the management?,1.0,https://www.reddit.com/r/FCInterMilan/comments/kdigl1/who_was_more_right_icardi_or_the_management/
adrenalinda75,1608021181.0,kdhzwb,31.0,1.0,FCInterMilan,Cragno for Ninja,1.0,https://www.reddit.com/r/FCInterMilan/comments/kdhzwb/cragno_for_ninja/
FCInterMilan,1607999697.0,kdcuux,3.0,1.0,FCInterMilan,Ballon d'Or Dream Team: Matthäus and Ronaldo included,1.0,https://www.inter.it/en/news/2020/12/14/dream-team-ballon-dor-matthaus-ronaldo.html
FCInterMilan,1607960234.0,kczve2,8.0,1.0,FCInterMilan,"Player Ratings Results: Cagliari 1-3 Inter (Serie A, Matchday 11)",1.0,https://www.reddit.com/gallery/kczve2
FCInterMilan,1607955714.0,kcyiay,0.0,1.0,FCInterMilan,INTER 3-1 BOLOGNA | HIGHLIGHTS | SERIE A 20/21 | Hakimi and Lukaku on fire! 🔥⚫🔵,1.0,https://www.youtube.com/watch?v=bEIreERHn5w
FCInterMilan,1607955671.0,kcyhtl,3.0,1.0,FCInterMilan,CLOSER BY MAGIC I INTER CHRISTMAS 2020 (feat. Meezy) ☃️⚫🔵,1.0,https://www.youtube.com/watch?v=GMrfJlgB7gI
Admant,1607940095.0,kcuvtn,4.0,1.0,FCInterMilan,When do you think we should replace our decadent GK?,1.0,https://www.reddit.com/r/FCInterMilan/comments/kcuvtn/when_do_you_think_we_should_replace_our_decadent/
philipagg,1607938743.0,kculyl,29.0,1.0,FCInterMilan,Asking for opinions,1.0,https://www.reddit.com/r/FCInterMilan/comments/kculyl/asking_for_opinions/
elic173,1607913833.0,kcoud2,15.0,1.0,FCInterMilan,Barella appreciation post,1.0,https://i.redd.it/hh2aphytf2561.jpg
AutoModerator,1607900681.0,kckzkm,37.0,1.0,FCInterMilan,Weekly free talk thread. AMALA! [Week #50],1.0,https://www.reddit.com/r/FCInterMilan/comments/kckzkm/weekly_free_talk_thread_amala_week_50/
Osva76,1607895325.0,kcjckk,2.0,1.0,FCInterMilan,Too much...,1.0,https://www.fcinter1908.it/primo-piano/terza-maglia-colorata/
heeeelpme666,1607887535.0,kcgueh,12.0,1.0,FCInterMilan,Handa out,1.0,https://www.reddit.com/r/FCInterMilan/comments/kcgueh/handa_out/
FCInterMilan,1607875194.0,kccz6u,5.0,1.0,FCInterMilan,Lukaku scares ball boy,1.0,https://twitter.com/DhariAbul/status/1338119307239239683
FCInterMilan,1607875051.0,kccxro,0.0,1.0,FCInterMilan,CAGLIARI 1-3 INTER | ANTONIO CONTE EXCLUSIVE INTERVIEW,1.0,https://www.youtube.com/watch?v=mJYHzyeSU84
FCInterMilan,1607874952.0,kccwo6,0.0,1.0,FCInterMilan,CAGLIARI 1-3 INTER | NICOLÒ BARELLA + DANILO D’AMBROSIO EXCLUSIVE INTERVIEWS [SUB ENG],1.0,https://www.youtube.com/watch?v=cq6u_mmM_vc
FCInterMilan,1607872011.0,kcc2v3,4.0,1.0,FCInterMilan,"Conte: “The guys deserve the praise, we were playing a good game, we created many chances in the first half, but we went one goal down. These situations can have an impact, the lads reacted well.”",1.0,https://www.football-italia.net/163414/conte-%E2%80%98someone-must-leave%E2%80%99
FCInterMilan,1607869543.0,kcbg9b,2.0,1.0,FCInterMilan,"Updated Fantasy League Leaderboard (Cagliari vs Inter, Serie A, Matchday 11)",1.0,https://airtable.com/shrE7MM4U15yv19Dk
FCInterMilan,1607868344.0,kcb5bn,1.0,1.0,FCInterMilan,Barella: “I'm a little bit sorry because I scored against Cagliari... I am a pro and I need to play and give my best for the team I’m playing for.”,1.0,https://www.football-italia.net/163413/barella-sorry-cagliari
Tonaz92,1607867550.0,kcay2l,4.0,1.0,FCInterMilan,Lukaku's 3rd goal be like,1.0,https://i.redd.it/7hsw6ho7my461.jpg
jaKz9,1607867513.0,kcaxqx,8.0,1.0,FCInterMilan,"Player Ratings Poll: Cagliari 1-3 Inter (Serie A, Matchday 11)",1.0,https://forms.gle/v7uJi3Wuqj6oQrc86
FCInterMilan,1607866863.0,kcas36,2.0,1.0,FCInterMilan,Cagliari 1-[3] Inter - Romelu Lukaku 90'+4',1.0,https://streamja.com/novVO
FCInterMilan,1607866852.0,kcas09,2.0,1.0,FCInterMilan,Cagliari 1-[2] Inter - Danilo D'Ambrosio 84',1.0,https://streamja.com/P32MQ
FCInterMilan,1607866825.0,kcarsm,73.0,1.0,FCInterMilan,"[Post-Match Discussion] Cagliari 1:3 Inter (Serie A, Matchday 11)",1.0,https://www.reddit.com/r/FCInterMilan/comments/kcarsm/postmatch_discussion_cagliari_13_inter_serie_a/
Sashh13,1607866598.0,kcaptq,20.0,1.0,FCInterMilan,Danilo is Love. Danilo is Life.,1.0,https://i.redd.it/k34d9pmdjy461.jpg
Cerozz,1607865921.0,kcak28,0.0,1.0,FCInterMilan,Cagliari 1-[1] Inter - Nicolo Barella 77',1.0,https://streamja.com/akW52
DLVittorio,1607865701.0,kcai9s,5.0,1.0,FCInterMilan,"You're losing against a mediocre team, that learned how to annihilate you by watching the other 80 games where you played exactly the same Conte:",1.0,https://i.redd.it/3wxjkxspgy461.jpg
FCInterMilan,1607864054.0,kca4z3,2.0,1.0,FCInterMilan,Marotta: ‘Inter can improve',1.0,https://www.football-italia.net/163402/marotta-%E2%80%98inter-can-improve-eriksen
heeeelpme666,1607861786.0,kc9nqw,0.0,1.0,FCInterMilan,Eriksen,1.0,https://www.reddit.com/r/FCInterMilan/comments/kc9nqw/eriksen/
FCInterMilan,1607855400.0,kc8fmt,274.0,1.0,FCInterMilan,"[Match Thread] Cagliari vs Inter (Serie A, Matchday 11)",1.0,https://www.reddit.com/r/FCInterMilan/comments/kc8fmt/match_thread_cagliari_vs_inter_serie_a_matchday_11/
FCInterMilan,1607784011.0,kbq4cs,10.0,1.0,FCInterMilan,Conte: 'Don't help those who hate Inter',1.0,https://www.football-italia.net/163362/conte-dont-help-those-who-hate-inter
FCInterMilan,1607742495.0,kbhid8,1.0,1.0,FCInterMilan,"Fantasy League: Cagliari vs Inter (Serie A, Matchday 11)",1.0,https://forms.gle/1vHZsryxjhPDFM4R6
FCInterMilan,1607741625.0,kbha5i,22.0,1.0,FCInterMilan,[Pre-Match Discussion] Cagliari vs Inter (Serie A Matchday 11),1.0,https://www.reddit.com/r/FCInterMilan/comments/kbha5i/prematch_discussion_cagliari_vs_inter_serie_a/
biscione92,1607718976.0,kbas1b,4.0,1.0,FCInterMilan,Reaction to Champions League Exit,1.0,https://www.reddit.com/r/FCInterMilan/comments/kbas1b/reaction_to_champions_league_exit/
FCInterMilan,1607715611.0,kb9ogx,2.0,1.0,FCInterMilan,Only One Path for Inter,1.0,https://www.football-italia.net/163332/only-one-path-inter
FCInterMilan,1607715545.0,kb9np7,0.0,1.0,FCInterMilan,Zhang: 'Our target doesn't change',1.0,https://www.football-italia.net/163334/zhang-our-target-doesnt-change
Assassins-Bleed,1607714563.0,kb9cfq,7.0,1.0,FCInterMilan,This is real...,1.0,https://i.ibb.co/3MdQ3rB/123.jpg
Dangthe,1607699603.0,kb4l27,23.0,1.0,FCInterMilan,"Inter Coach Antonio Conte Offered To Step Down In Meeting With Management Yesterday, Italian Media Claim",1.0,https://sempreinter.com/2020/12/11/inter-coach-antonio-conte-offered-to-step-aside-from-position-in-meeting-with-management-yesterday-italian-media-claim/
