author,created_utc,id,num_comments,score,subreddit,title,upvote_ratio,url
5kyLegend,1601392615.0,j216tb,23.0,1.0,FCInterMilan,Radja Nainggolan won't be present against Benevento because of a case of pharyngitis,1.0,https://twitter.com/Inter/status/1310956211576229896
Bucksandreds,1601391338.0,j20s1u,7.0,1.0,FCInterMilan,Marcos Alonso on the outs at Chelsea,1.0,https://www.reddit.com/r/FCInterMilan/comments/j20s1u/marcos_alonso_on_the_outs_at_chelsea/
FCInterMilan,1601383140.0,j1yeih,1.0,1.0,FCInterMilan,Pre-Match Press Conference: Benevento vs Inter,1.0,https://www.youtube.com/watch?v=fNKCKOU8Rbs
FCInterMilan,1601382662.0,j1ya5k,22.0,1.0,FCInterMilan,[Pre-Match Discussion] Benevento vs Inter (Serie A Matchday 1),1.0,https://www.reddit.com/r/FCInterMilan/comments/j1ya5k/prematch_discussion_benevento_vs_inter_serie_a/
vik1980,1601356779.0,j1t1oa,28.0,1.0,FCInterMilan,"If Skriniar's sold, I hope the replacement is Milenkovic",0.99,https://www.reddit.com/r/FCInterMilan/comments/j1t1oa/if_skriniars_sold_i_hope_the_replacement_is/
Spyro619,1601313614.0,j1gavv,4.0,1.0,FCInterMilan,CEO Tronchetti Provera Confirms Pirelli No Longer Inter's Main Shirt Sponsor,1.0,https://www.google.com/amp/s/sempreinter.com/2020/09/28/ceo-tronchetti-provera-confirms-pirelli-no-longer-inters-main-shirt-sponsor-but-partnership-will-continue-in-some-way/amp/
dondostuff,1601310544.0,j1f9x1,7.0,1.0,FCInterMilan,Oops,1.0,https://i.redd.it/pwe7y5cv0xp51.jpg
lesliezardemmarodrig,1601304488.0,j1dcnz,3.0,1.0,FCInterMilan,Why no news on Icardi?,1.0,https://www.reddit.com/r/FCInterMilan/comments/j1dcnz/why_no_news_on_icardi/
head_in_the_clouds69,1601290349.0,j19tqh,19.0,1.0,FCInterMilan,"First the foreigners, now the 5 changes: the latest media controversy about Inter goes beyond embarrassment",1.0,https://www.reddit.com/r/FCInterMilan/comments/j19tqh/first_the_foreigners_now_the_5_changes_the_latest/
meisteroland,1601289338.0,j19msp,9.0,1.0,FCInterMilan,Why Handanovic is still our goalkeeper?,1.0,https://www.reddit.com/r/FCInterMilan/comments/j19msp/why_handanovic_is_still_our_goalkeeper/
AutoModerator,1601247893.0,j10tqe,42.0,1.0,FCInterMilan,Weekly free talk thread. AMALA! [Week #39],1.0,https://www.reddit.com/r/FCInterMilan/comments/j10tqe/weekly_free_talk_thread_amala_week_39/
jalan-jalan,1601230523.0,j0vv6u,2.0,1.0,FCInterMilan,DeVrij after saw the defence last night and ready to build a wall for next match.,1.0,https://i.redd.it/730zkmbweqp51.jpg
chris_5219,1601225689.0,j0ug77,12.0,1.0,FCInterMilan,Is Nainggolan Staying At Inter?,1.0,https://www.reddit.com/r/FCInterMilan/comments/j0ug77/is_nainggolan_staying_at_inter/
RobinXoxoxo,1601212638.0,j0qy1p,17.0,1.0,FCInterMilan,"6 - With the victory against Fiorentina, Inter have won six league games after being in a trailing position after the 85th minute of play, more than any other side in the Serie A history. Perseverance.",1.0,https://twitter.com/OptaPaolo/status/1310151632445943808
RobinXoxoxo,1601211011.0,j0qkea,17.0,1.0,FCInterMilan,"[Fabrizio Romano] Tottenham are still in talks with Inter to sign Milan Skriniar. He’s the #1 target on Mourinho’s list, as reported days ago. Inter want around €60m [or €50m w/add ons]. #THFC were expecting to spend €30/35m. Spurs are now considering a new bid.",1.0,https://twitter.com/FabrizioRomano/status/1310194272872943616
Sneijder4BallondOr,1601208299.0,j0q03o,0.0,1.0,FCInterMilan,Inter 4-3 Fiorentina | Open Access,1.0,https://youtu.be/UfzWVzPQwvQ
Nexonos,1601207995.0,j0pxpo,0.0,1.0,FCInterMilan,How Antonio Conte Transformed Inter Milan | Conte's Inter Milan Tactics |,1.0,https://www.youtube.com/watch?v=9ylbibYebko
Cerozz,1601192790.0,j0n6rm,16.0,1.0,FCInterMilan,"[Di Marzio] Inter will sell Ranocchia in upcoming week. Darmian will come as replacement, it's done deal and contracts are ready. Remaining transfers depend on sales; if Škriniar will be sold, Inter will go for one of Milenković, Smalling or Kabak, in that order.",1.0,https://www.fcinter1908.it/calciomercato/esce-skriniar-nomi/
RealBigChief,1601189411.0,j0mju5,0.0,1.0,FCInterMilan,Allen Zhao on Twitter,1.0,https://twitter.com/allenzhaoAZ/status/1309956281483001857?s=20
Sashh13,1601173030.0,j0iwoo,7.0,1.0,FCInterMilan,🐐,1.0,https://i.redd.it/18zxo1rynlp51.jpg
Sneijder4BallondOr,1601160842.0,j0fq6m,0.0,1.0,FCInterMilan,Inter 4-3 Fiorentina | Conte Interview,1.0,https://youtu.be/ZH7ieTzK7iI
Sneijder4BallondOr,1601160806.0,j0fpth,0.0,1.0,FCInterMilan,"Inter 4-3 Fiorentina | Lautaro, D'Ambrosio, &amp; Sensi Interviews",1.0,https://youtu.be/6r5sMlwYYSM
Double-Knee,1601158284.0,j0f0h0,31.0,1.0,FCInterMilan,"[Fabrizio Romano] Antonio Conte to @SkySport : ""Skriniar to Tottenham? He's part of our project here at Inter. But I don't know if an important bid will arrive in the coming days... it's possible that the club will consider it because of the financial situation"".",1.0,https://twitter.com/FabrizioRomano/status/1309972278399119360
ibrahimahmed75,1601157708.0,j0euaz,16.0,1.0,FCInterMilan,Why the hate on Eriksen,1.0,https://www.reddit.com/r/FCInterMilan/comments/j0euaz/why_the_hate_on_eriksen/
RWND,1601155752.0,j0e9gy,2.0,1.0,FCInterMilan,PAZZA INTER AMALA!!!!,1.0,https://www.reddit.com/r/FCInterMilan/comments/j0e9gy/pazza_inter_amala/
BeerAndBeard,1601153978.0,j0dqw9,12.0,1.0,FCInterMilan,"Not at all, I’m so relaxed.",1.0,https://i.redd.it/7cw3wlib3kp51.jpg
RobinXoxoxo,1601152985.0,j0dgo3,19.0,1.0,FCInterMilan,"Post Match Player Ratings: Inter 4-3 Fiorentina (Matchday 2, Serie A)",1.0,https://forms.gle/YgCsVNTeKayNdKZU7
RobinXoxoxo,1601152676.0,j0ddg0,7.0,1.0,FCInterMilan,Inter [4]-3 Fiorentina - Danilo D'Ambrosio 89',1.0,https://streamja.com/ew4Pq
6_Six_6ix,1601152653.0,j0dd6z,18.0,1.0,FCInterMilan,D’Ambrosinho appreciation thread.,1.0,https://www.reddit.com/r/FCInterMilan/comments/j0dd6z/dambrosinho_appreciation_thread/
RobinXoxoxo,1601152610.0,j0dcoz,1.0,1.0,FCInterMilan,Inter [3]-3 Fiorentina - Romelu Lukaku 87',1.0,https://streamja.com/Kyolv
RobinXoxoxo,1601150528.0,j0crcq,1.0,1.0,FCInterMilan,Inter [2]-1 Fiorentina - Ceccherini OG 52',1.0,https://streamye.com/viqbz
Cerozz,1601145824.0,j0bdol,36.0,4.0,FCInterMilan,"Piero Ausilio: ""Tottenham are interested in Milan Skriniar. We had a meeting but we told them we don’t want to sell also Skriniar after Diego Godin"".",1.0,https://twitter.com/FabrizioRomano/status/1309926089251225601
Cerozz,1601145800.0,j0bdf2,7.0,2.0,FCInterMilan,"Piero Ausilio to DAZN: ""Kanté is not on the market, he’s a starter at Chelsea. We’re not in talks for him also because we’ve already 8 midfielders in our team"".",1.0,https://twitter.com/FabrizioRomano/status/1309925527483027456?s=19
BanterburyTales,1601144815.0,j0b2z2,16.0,2.0,FCInterMilan,"At This Point, Why Would We Need to Sell?",1.0,https://www.reddit.com/r/FCInterMilan/comments/j0b2z2/at_this_point_why_would_we_need_to_sell/
FCInterMilan,1601142312.0,j0af6d,714.0,2.0,FCInterMilan,[Match Thread] Inter vs Fiorentina (Serie A Matchday 2),1.0,https://www.reddit.com/r/FCInterMilan/comments/j0af6d/match_thread_inter_vs_fiorentina_serie_a_matchday/
RobinXoxoxo,1601120654.0,j04m7y,4.0,1.0,FCInterMilan,"[Fabrizio Romano] Koeman doesn't rule out Depay or Lautaro, but Fabrizio suggests Lautaro will stay.",1.0,https://twitter.com/FabrizioRomano/status/1309815152028651523
Byspenc,1601118858.0,j049lm,0.0,1.0,FCInterMilan,I love this guy,1.0,https://www.reddit.com/gallery/j049lm
RobinXoxoxo,1601116669.0,j03uw6,0.0,1.0,FCInterMilan,[Inter Media House] Inter vs Fiorentina: Ready for the new season,1.0,https://www.youtube.com/watch?v=-5SBa-XftK0&amp;ab_channel=Inter
Cerozz,1601111874.0,j02yqm,21.0,1.0,FCInterMilan,Sampdoria's a hilarious Antonio Candreva announcement video.,1.0,https://twitter.com/sampdoria_en/status/1309532336736919553
jalan-jalan,1601103793.0,j01den,20.0,1.0,FCInterMilan,Lautaro Martinez's move to Barcelona is fading like a sugar cube in a coffee.,1.0,https://www.marca.com/en/football/barcelona/2020/09/25/5f6ddf6522601dd4638b45a4.html
vik1980,1601102342.0,j012pf,4.0,1.0,FCInterMilan,Inter's predicted line up against Fiorentina troubles me,0.99,https://www.reddit.com/r/FCInterMilan/comments/j012pf/inters_predicted_line_up_against_fiorentina/
FCInterMilan,1601059503.0,izpbc8,3.0,1.0,FCInterMilan,[Pre-Match Discussion] Inter vs Fiorentina (Serie A Matchday 2),1.0,https://www.reddit.com/r/FCInterMilan/comments/izpbc8/prematch_discussion_inter_vs_fiorentina_serie_a/
RobinXoxoxo,1601059376.0,izp9rh,4.0,1.0,FCInterMilan,[FC Lorient Official] Andrew Gravillon goes on loan to FC Lorient.,1.0,https://twitter.com/FCLorient/status/1309526480846753797
RobinXoxoxo,1601053938.0,izniiy,14.0,1.0,FCInterMilan,"[Inter Official] As expected with the departure of Godín, Hakimi picks the number 2 for his shirt!",1.0,https://twitter.com/Inter_en/status/1309539749682655232
FCInterMilan,1601053281.0,iznalx,6.0,1.0,FCInterMilan,Introducing Our Fantasy League 20/21,1.0,https://www.reddit.com/r/FCInterMilan/comments/iznalx/introducing_our_fantasy_league_2021/
RobinXoxoxo,1601052427.0,izn0vp,6.0,1.0,FCInterMilan,[Inter Official] Eddie Salcedo joins Hellas Verona on loan with option to buy. Inter has a buy-back clause.,1.0,https://www.inter.it/en/news/2020/09/25/transfer-salcedo-hellas-verona.html
MariPetr,1601051997.0,izmvq8,2.0,1.0,FCInterMilan,Inter's unity after many speculations,1.0,https://www.instagram.com/p/CFkPjY_hm0w/?igshid=mr9svaxpy220
Cerozz,1601051951.0,izmv88,13.0,1.0,FCInterMilan,OFFICIAL: Antonio Candreva joins Sampdoria on a loan with obligation to buy for €2.5m.,1.0,https://www.inter.it/en/news/2020/09/25/transfer-window-antonio-candreva-sampdoria.html
ArminbanVuuren,1601047061.0,izlbxc,20.0,1.0,FCInterMilan,Will anyone else be embarrassed if we let Skriniar go for €45M or less?,1.0,https://www.reddit.com/r/FCInterMilan/comments/izlbxc/will_anyone_else_be_embarrassed_if_we_let/
5kyLegend,1601038076.0,izit1c,13.0,1.0,FCInterMilan,Conte and Marotta's Press Conference for the 2020/2021 Season,1.0,https://www.reddit.com/r/FCInterMilan/comments/izit1c/conte_and_marottas_press_conference_for_the/
RobinXoxoxo,1601035020.0,izi3t2,0.0,1.0,FCInterMilan,[Inter Official] Season 19-20 season ticket refunds (until 31st October),1.0,https://www.inter.it/en/news/2020/09/25/season-ticket-holder-refunds-2019-2020.html
Cerozz,1600984399.0,iz6pxo,6.0,1.0,FCInterMilan,[Di Marzio] Inter are considering Schalke 04 defender Ozan Kabak as potential replacement for Škriniar if he departs.,1.0,https://gianlucadimarzio.com/en/en-inter-considering-kabak-as-potential-replacement-for-skriniar
FCInterMilan,1600977638.0,iz4krv,26.0,1.0,FCInterMilan,[Pre-Match Discussion] Inter vs Fiorentina (Serie A Matchday 2),1.0,https://www.reddit.com/r/FCInterMilan/comments/iz4krv/prematch_discussion_inter_vs_fiorentina_serie_a/
menzo09,1600976396.0,iz46rm,6.0,1.0,FCInterMilan,Sebastiano Esposito's farewell message on Instagram,1.0,https://www.instagram.com/p/CFh48mvAvPo/
Cerozz,1600975242.0,iz3tpd,2.0,1.0,FCInterMilan,OFFICIAL: Diego Godín joins Cagliari!,1.0,https://www.cagliaricalcio.com/newsamp/ultimissime/19997/diego-godin-firma-per-il-cagliari-il-capitano-dell-uruguay-e-rossoblu?__twitter_impression=true
Schned6,1600965296.0,iz0ls0,17.0,1.0,FCInterMilan,What caused Frank de Boer to fail in his time at Inter?,1.0,https://www.reddit.com/r/FCInterMilan/comments/iz0ls0/what_caused_frank_de_boer_to_fail_in_his_time_at/
mykneehurtsss,1600965191.0,iz0kls,8.0,1.0,FCInterMilan,Candreva announces Inter departure with farewell post on Instagram,1.0,https://www.instagram.com/p/CFhkhdODSNu/?igshid=1tvb54bagakh2
Cerozz,1600963381.0,iyzzq0,7.0,1.0,FCInterMilan,Godin has posted a farewell message on Twitter,1.0,https://www.reddit.com/r/FCInterMilan/comments/iyzzq0/godin_has_posted_a_farewell_message_on_twitter/
Cerozz,1600954233.0,iyxahs,28.0,1.0,FCInterMilan,[Di Marzio] Sampdoria to sign Antonio Candreva.,1.0,https://twitter.com/DiMarzio/status/1309121694943117312
Byspenc,1600952241.0,iywr41,5.0,1.0,FCInterMilan,Perhaps Iturbe and Barella's suspiciously similar appearance is the main reason Conte stayed in Inter,1.0,https://i.redd.it/1ce9ll5gf3p51.jpg
sco92,1600951178.0,iywh6m,17.0,1.0,FCInterMilan,I come in peace ( Juventus - Inter ),1.0,https://www.reddit.com/r/FCInterMilan/comments/iywh6m/i_come_in_peace_juventus_inter/
ale93p,1600946099.0,iyv9wi,9.0,1.0,FCInterMilan,I would like to reason a bit around our 20/21 squad,1.0,https://www.reddit.com/r/FCInterMilan/comments/iyv9wi/i_would_like_to_reason_a_bit_around_our_2021_squad/
jalan-jalan,1600944674.0,iyuz4b,3.0,1.0,FCInterMilan,Official : Lucien Agoumé loaned to Spezia until 30 june 2021. And he choose #10.,1.0,https://www.inter.it/it/news/2020/09/24/calciomercato-inter-agoume-spezia.html
DLVittorio,1600932067.0,iyslb9,6.0,1.0,FCInterMilan,Today's Gazzetta (link in comments) for everyone that wants to read Big Rom interview,1.0,https://i.redd.it/u9uygupgr1p51.jpg
seconato,1600928665.0,iyry27,3.0,1.0,FCInterMilan,My Barella Artwork AMALA!,1.0,https://i.redd.it/eiyi04ybh1p51.png
coLfan123,1600900870.0,iykzif,28.0,1.0,FCInterMilan,I don't understand the attachment some Interisti have with Skriniar. He's only been here for 3 seasons. &amp; only really performed at a world class level for 1 season. Why are we acting like we're letting go of a club legend?,1.0,https://www.reddit.com/r/FCInterMilan/comments/iykzif/i_dont_understand_the_attachment_some_interisti/
coLfan123,1600900285.0,iyksoe,1.0,1.0,FCInterMilan,I don't understand people's attachment to Skriniar. He's only been here for 3 years. And he doesn't fit our system.,1.0,https://www.reddit.com/r/FCInterMilan/comments/iyksoe/i_dont_understand_peoples_attachment_to_skriniar/
pbjelica23,1600895832.0,iyjdab,54.0,1.0,FCInterMilan,[ Fabrizio Romano ] Meeting today in Milano between Tottenham and Inter for Milan Skriniar. Spurs won’t match €60m price tag - Skriniar value according to #THFC is around €50m add ons included. No agreement atm. Talks on. Ruben Dias still a serious option.,1.0,https://twitter.com/FabrizioRomano/status/1308876995057651712?s=19
Cerozz,1600892667.0,iyiauw,9.0,1.0,FCInterMilan,"[SportItalia] Ranocchia's agents have met with Inter regarding his future at Inter. Genoa, Parma and Sassuolo are interested.",1.0,https://www.football-italia.net/159290/report-ranocchias-agents-meet-inter
Zokeyy,1600866430.0,iy9qgq,28.0,1.0,FCInterMilan,"Di Marzio: Napoli have contacted Inter for Vecino. Player has given his approval. It would be a loan with option to buy that becomes obligation after a certain number of appearances. Inter want €18m for permanent transfer, Napoli are willing to offer €12m.",1.0,https://gianlucadimarzio.com/it/napoli-vecino-inter-calciomercato
commando_and_hobbes,1600865921.0,iy9l7m,1.0,1.0,FCInterMilan,"[Fabrizio Romano] Napoli open talks with inter for Vecino, personal terms still to be agreed",1.0,https://twitter.com/FabrizioRomano/status/1308751450928025603?s=19
Cerozz,1600859975.0,iy87bd,9.0,1.0,FCInterMilan,[Inter Media House] ARTURO VIDAL | #WELCOMEVIDAL | INTER 2020/21 🇨🇱⚫🔵👑,1.0,https://www.youtube.com/watch?v=11OacBZp6Rg
chris_5219,1600812558.0,ixxhmf,2.0,1.0,FCInterMilan,Who Will Be Our Replacement For handanovic?,1.0,https://www.reddit.com/r/FCInterMilan/comments/ixxhmf/who_will_be_our_replacement_for_handanovic/
coLfan123,1600805489.0,ixv97a,41.0,1.0,FCInterMilan,What a difference a few years make. Feels like it was yesterday,1.0,https://i.redd.it/y0h38sgqaro51.jpg
coLfan123,1600805258.0,ixv6il,0.0,1.0,FCInterMilan,What a difference a few years make. Crazy to think we were to be top of the league for a few months with that midfield,1.0,https://srv2.imgonline.com.ua/result_img/imgonline-com-ua-twotoone-bZjoeu6oTtusy0.jpg
Sneijder4BallondOr,1600797133.0,ixsgvb,0.0,1.0,FCInterMilan,Vidal's First Training Session!,1.0,https://youtu.be/hLjgiClsSoI
Gagliardinter,1600745616.0,ixftza,0.0,1.0,FCInterMilan,No wonder Conte wants Nainggolan sold.,1.0,https://v.redd.it/31w7ficz3io51
maderfacher,1600713563.0,ix6e2e,0.0,1.0,FCInterMilan,"[Alfredo Pedullà] Agreement between Inter and SPAL for Esposito loan, waiting to see if player accepts. Tonight may get answer from Candreva in regards to moving to Sampdoria.",1.0,https://twitter.com/alfredopedulla/status/1308094113175273473?s=21
ultimatebot3000,1600706592.0,ix41we,0.0,1.0,FCInterMilan,INTER 7-0 PISA | OPEN ACCESS + EXTENDED HIGHLIGHTS | Fans return as Inter hit 7️⃣once again! 🙌⚫🔵,1.0,https://www.youtube.com/watch?v=Md3qYNYxdrE&amp;ab_channel=Inter
Cerozz,1600703743.0,ix33t6,0.0,1.0,FCInterMilan,[Di Marzio] Tomorrow Agoumé will join Spezia on a 1-year loan.,1.0,https://gianlucadimarzio.com/it/spezia-calciomercato-news-agoume-pobega-djidji-santander
jalan-jalan,1600699561.0,ix1sj7,1.0,1.0,FCInterMilan,What happen with this guy. Is he injured or in recovery or something? He's listed in first team squad but he's not in pre season camp. Even Asamoah still training in Appiano Gentile.,1.0,https://i.redd.it/0keyee13kio51.jpg
oxy-kun,1600689971.0,iwz3x9,15.0,1.0,FCInterMilan,Do you agree with Conte wanting to get rid of Brozovic in order to get Kante?,1.0,https://www.reddit.com/r/FCInterMilan/comments/iwz3x9/do_you_agree_with_conte_wanting_to_get_rid_of/
BrokenRetina,1600650515.0,iwqj9y,6.0,1.0,FCInterMilan,War of the Mohawks: Who Wins Edition?,1.0,https://i.redd.it/idkcy497ieo51.jpg
v-d-c,1600648212.0,iwpx9l,8.0,1.0,FCInterMilan,"The Faces, Stats &amp; Overalls of the Inter players in PES 2021",1.0,https://youtu.be/176RgmLiFuM
danccmeighmeighs,1600635173.0,iwm0fh,2.0,1.0,FCInterMilan,The season is off to a bright start already.,1.0,https://www.instagram.com/p/CFXxscOpfjJ/
ShJakupi,1600626649.0,iwjagn,12.0,1.0,FCInterMilan,The formation in pre season games?,1.0,https://www.reddit.com/r/FCInterMilan/comments/iwjagn/the_formation_in_pre_season_games/
coLfan123,1600624048.0,iwih9m,3.0,1.0,FCInterMilan,Brozovic has yet to play a single minute in the pre season. Is he on his way out?,1.0,https://www.reddit.com/r/FCInterMilan/comments/iwih9m/brozovic_has_yet_to_play_a_single_minute_in_the/
-ilGrandePuffo-,1600592827.0,iwak9k,22.0,1.0,FCInterMilan,Why do you think we’ll win serie a? Or why not?,1.0,https://www.reddit.com/r/FCInterMilan/comments/iwak9k/why_do_you_think_well_win_serie_a_or_why_not/
FCInterMilan,1600562737.0,iw46hc,7.0,1.0,FCInterMilan,Inter vs Pisa Full Match,1.0,https://www.youtube.com/watch?v=D4kTK93SNGU
afcSanti,1600547514.0,iw07wb,50.0,1.0,FCInterMilan,"Arturo Vidal to Inter, here we go! Tomorrow he’ll fly to Milano. Total agreement reached with Barça for €1m as final fee. Antonio Conte is waiting for him. Meanwhile Diego Godin will leave Inter to join Cagliari on next week. 🚨🇨🇱 @DiMarzio @SkySport #fcb #inter #vidal #barça",1.0,https://twitter.com/fabrizioromano/status/1307416955146645516?s=21
tshirttimeaz,1600532209.0,ivvhsc,0.0,1.0,FCInterMilan,No Broadcast Today?,1.0,https://www.reddit.com/r/FCInterMilan/comments/ivvhsc/no_broadcast_today/
FCInterMilan,1600528700.0,ivuene,21.0,1.0,FCInterMilan,[Match Thread] Inter vs Pisa (Pre-Season Friendly),1.0,https://www.reddit.com/r/FCInterMilan/comments/ivuene/match_thread_inter_vs_pisa_preseason_friendly/
Prostowned,1600527792.0,ivu4or,0.0,1.0,FCInterMilan,This video ranks the football teams based on how many UEFA Champions League they have won from 1956 to 2020.,1.0,https://youtu.be/S0BWAq2R2H4
rth9139,1600522165.0,ivsk3i,8.0,1.0,FCInterMilan,People’s thoughts on the X Factors for this season?,1.0,https://www.reddit.com/r/FCInterMilan/comments/ivsk3i/peoples_thoughts_on_the_x_factors_for_this_season/
MariPetr,1600516883.0,ivrafu,2.0,1.0,FCInterMilan,[Primavera-U19] HT: Inter - Sampdoria [1] - [0] S.Esposito 27',1.0,https://www.fcinter1908.it/copertina/primavera-inter-sampdoria/
Calcio_guy,1600496783.0,ivnbcf,2.0,1.0,FCInterMilan,Only Lu-La can win Inter the scudetto this season,1.0,https://www.reddit.com/r/FCInterMilan/comments/ivnbcf/only_lula_can_win_inter_the_scudetto_this_season/
phoneix150,1600482903.0,ivk4iy,0.0,1.0,FCInterMilan,Azzurri legend Christian Vieri considers cricket return in Italy,1.0,https://emergingcricket.com/news/azzurri-legend-vieri-considers-cricket-return-in-italy/
Cerozz,1600453404.0,ivbjrn,3.0,4.0,FCInterMilan,Inter 7-0 Carrarese | Training match highlights,1.0,https://www.youtube.com/watch?v=c8l-PVy6xlk
interista845,1600450448.0,ivam76,19.0,3.0,FCInterMilan,"Looks like Godin is Out and Vidal is In, only the official announcement missing. Who do you think will replace him? Darmian or someone else?",1.0,https://twitter.com/fabrizioromano/status/1307002383130677254?s=21
[deleted],1600449362.0,iva9yc,0.0,1.0,FCInterMilan,"[Fabrizio Romano, Di Marzio] Diego Godin to Cagliari, here we go! Agreement almost reached, he’s going to leave Inter as a free agent and will sign until June 2023 as new Cagliari player. Last details to be completed soon. Then Arturo Vidal will join to Inter [done deal].",1.0,https://twitter.com/FabrizioRomano/status/1307002383130677254
5kyLegend,1600448375.0,iv9y54,14.0,2.0,FCInterMilan,Inter - Carrarese friendly match ends 7 - 0 for the Nerazzurri,1.0,https://twitter.com/Inter/status/1307000501406494723
realalibahzad,1600441386.0,iv7q7d,0.0,1.0,FCInterMilan,2020/21 Transfer Wishlist,1.0,https://www.reddit.com/r/FCInterMilan/comments/iv7q7d/202021_transfer_wishlist/
ArminbanVuuren,1600440804.0,iv7js0,2.0,2.0,FCInterMilan,"I know I personally have spent hours searching the internet for an Inter GK jersey, but it looks like we're selling them this year! Figured I'd share for any fellow GKs",1.0,https://store.inter.it/en/inter-orange-ls-goalkeeper-jersey-2020-21.html
Messsi3,1600429448.0,iv4i1e,41.0,0.0,FCInterMilan,Torreira.,0.14,https://www.reddit.com/r/FCInterMilan/comments/iv4i1e/torreira/
DLVittorio,1600381654.0,iutvy3,10.0,1.0,FCInterMilan,"Before posting again something coming from Nico Schirá please, read this. (Also, mods please)",1.0,https://twitter.com/Millar_Colin/status/1245352323406278657?s=19
RaynerOP,1600362025.0,iunjw6,33.0,1.0,FCInterMilan,Schira - Pinamonti will go back to Inter: Loan (€4/5M) with obligation to buy (€15M). There needs to be seen if he’s going to be the 4th striker or will be loaned again.,1.0,https://mobile.twitter.com/NicoSchira/status/1306622238066606082
Cerozz,1600356282.0,iulmm6,4.0,1.0,FCInterMilan,"Romelu Lukaku, Éver Banega (Sevilla) and Bruno Fernandes (Manchester United) have been nominated for the 2019/20 UEFA Europa League Player of the Season award.",1.0,https://www.uefa.com/insideuefa/mediaservices/mediareleases/news/0261-10657c4cbf33-3fc280ec8da7-1000--shortlist-of-nominees-for-2019-20-uefa-club-competition-awards-/
Cerozz,1600351997.0,iuk9ll,0.0,1.0,FCInterMilan,Inter have signed 19-year-old Swiss U18 international Darian Males on a 5-year deal.,1.0,https://www.inter.it/en/news/2020/09/16/transfer-inter-darian-males.html
Double-Knee,1600337785.0,iugoxd,0.0,1.0,FCInterMilan,Inter friendly vs Carrarese cancelled?,1.0,https://www.reddit.com/r/FCInterMilan/comments/iugoxd/inter_friendly_vs_carrarese_cancelled/
jalan-jalan,1600336111.0,iugcta,0.0,1.0,FCInterMilan,"Let me go, it's okay.",1.0,https://i.redd.it/gdfh2qzcjon51.jpg
theinterway,1600327431.0,iuenb3,0.0,1.0,FCInterMilan,"Made this for my blog, Instagram and other social media. Do you guys think this format fits well for match days or should I change something?",1.0,https://i.redd.it/dxapq6cbtnn51.png
commando_and_hobbes,1600291765.0,iu5827,1.0,1.0,FCInterMilan,[Di Marzio] Genoa close to Candreva,1.0,https://twitter.com/DiMarzio/status/1306340223371169794?s=19
Crimson369,1600271187.0,ity472,3.0,1.0,FCInterMilan,New signing,1.0,https://www.reddit.com/r/FCInterMilan/comments/ity472/new_signing/
lunatic5467,1600267756.0,itwzdp,3.0,1.0,FCInterMilan,"An achraf Hakimi poster a made not my best work, but I'm still proud of it hope you like it .",1.0,https://i.redd.it/d9g256rmvin51.jpg
jalan-jalan,1600264003.0,itvtzi,8.0,1.0,FCInterMilan,"Due to concern about Sensi's foot vulnerabilty, this is how he'll move from place to place this season. Keep healty Lionel Sensi.",1.0,https://v.redd.it/c081quuxkin51
jalan-jalan,1600263391.0,itvn2q,0.0,1.0,FCInterMilan,"Due to concern about Sensi's foot vulnerabilty, this is how he'll move from place to place this season. Keep healty Lionel Sensi.",1.0,https://instagram.com/stories/dalbert/2399327212746047954?utm_source=ig_story_item_share&amp;igshid=820igdu19j2z
apericena,1600262520.0,itvd7t,4.0,1.0,FCInterMilan,Why does Inter continue to keep under contract Samuele Longo?,1.0,https://www.reddit.com/r/FCInterMilan/comments/itvd7t/why_does_inter_continue_to_keep_under_contract/
RobinXoxoxo,1600256983.0,ittwl7,4.0,1.0,FCInterMilan,Diego Godin's lawyers left Cagliari without sealing his departure from Inter. Inter is not complying with the agreement to finalize it and Cagliari can't register him. To all this Vidal is still unable to formalize his departure from Barça to Inter Milan as per @moillorens,1.0,https://twitter.com/moillorens/status/1306176271727112193?s=19
jalan-jalan,1600249718.0,itsgxb,5.0,1.0,FCInterMilan,"Yay, I guess...!?",1.0,https://i.redd.it/6r9idr3hehn51.jpg
VZ-Faith,1600237608.0,itqb58,0.0,1.0,FCInterMilan,INTER 5-0 LUGANO | OPEN ACCESS | Inter hit five in first pre-season friendly 📹⚫🔵,1.0,https://www.youtube.com/watch?v=P_ofCqniCNs
Jalapinho,1600215354.0,itkwr6,7.0,1.0,FCInterMilan,Perisic and Nainggolan back?,1.0,https://www.reddit.com/r/FCInterMilan/comments/itkwr6/perisic_and_nainggolan_back/
Cerozz,1600201648.0,itgyis,18.0,1.0,FCInterMilan,"[Alfredo Pedullà] Inter will bring back Pinamonti. When he was sold to Genoa for €18m last year, there was also a gentleman's agreement to buy him back this year for €19m. Inter will then decide whether to keep him as 4th striker or loan him out.",1.0,https://www.alfredopedulla.com/esclusiva-pinamonti-base-di-intesa-tra-genoa-e-inter-per-il-ritorno-in-nerazzurro/
